tweet_id	tweet_text	class_label
1106864716910088192	#CycloneIdai Safety Tips 9. Invest in sandbags to place against doorways and low-level vents during flooding. Move high-value items to the highest floor in your home or a shelf;	caution_and_advice
1116077181694816258	Govt has made a #CycloneIdai International Humanitarian Assistance Appeal totalling US$612.6 million in the following sectors : Food, Security &amp; Nutrition,WASH, Emergency shelter,Health, Education, Protection,Logistics &amp; emergency comms,Environment,forestry &amp; wildlife restoration	caution_and_advice
1110166341208674304	Cholera cases have been reported &amp; there is threat of more waterborne diseases. Lack of clean water &amp; access to sanitation facilities are huge problems facing survivors. CARE are currently distributing hygiene kits. #CycloneIdai @decappeal	caution_and_advice
1113161514591096834	ὪBViolence against women and girls ὪBSexual abuse and exploitation These are worrying issues in any emergency or crisis, like #CycloneIdai in #Mozambique #Zimbabwe and #Malawi. With our partners, we are increasing all efforts to prevent it from happening.	caution_and_advice
1107975360711483393	The @IFRC warns that the situation could be far worse in the areas surrounding #Beira, which remain completely cut off by road and where houses are not as sturdy #CycloneIdai	caution_and_advice
1107926439448506369	Never walk, swim, drive through flood water or venture into unsafe/ disused mine shafts, report any missing persons to police as soon as it is practical to do so. In case of emergency dial 112 or 111. #cpu #CycloneIdai	caution_and_advice
1110650579800547332	This sanitary kit and blanket will go a long way to improve my privacy and dignity. Imagine, I was using a plastic paper as a blanket at the emergency camp, Elizabeth Major, Phalombe. #GENETResponse #CycloneIdai #MalawiFloods2019	caution_and_advice
1110219030256930816	I fear that the emergency situation caused by #cycloneidai is distracting us from the escalating insurgency in Cabo Delgado #Mozambique.	caution_and_advice
1113471337270530048	Mozambique: Cyclone Idai &amp; Floods Flash Update No. 15, 01 April 2019  via @reliefweb	caution_and_advice
1109833139210334208	The ministry has confused operatives. Tweeting about evacuation(rural folk will not see) instead of deploying soldiers to lead the process of informing residents of the seriousness of the warning. Acting like they gave free gadgets &amp; data during the campaign in place of regalia	displaced_people_and_evacuations
1108024180048568321	Nhamatanda-Beira road: Detours to guarantee assistance to displaced people to be opened  #Mozambique #Idai #CycloneIdai #CicloneIdai	displaced_people_and_evacuations
1112057961902428160	Displaced girls living in shelters are at greater risk of gender-based violence. Many are living in overcrowded shelters following #CycloneIdai. They need support and protection.	displaced_people_and_evacuations
1112632417049890816	@Khalsa_Aid lorries with #aid left @ 2am, we left @ 6am. Getting to Chikwawa #malawi where hundreds of thousands displaced due to #CycloneIdai #malawifloods2019 was not easy. We had to half pack the lorries so they do not get stuck; our 4x4 had trouble getting there. #sewa	displaced_people_and_evacuations
1116038010338856961	We visited a camp in Bangula, Malawi, today. Thousands of displaced residents are there after severe flooding in the region last month. They have nowhere to go. Donations from SA were handed over to the Malawian government and will be distributed soon. #CycloneIdai	displaced_people_and_evacuations
1107302346340687872	i come from a country where my President hires a 3million US dollar jet to travel abroad but cant hire a 70 RTGS dollar Zupco bus to evacuate people from the deadly cyclone areas #CycloneIdai	displaced_people_and_evacuations
1108660622034698242	@PacheduZW @mawarirej @InfoMinZW Of course govt as principal protector couldve done better, but truth is we were all caught unawares. Nobody imagined #CycloneIdai could turn out this bad. Thats why even CSOs -including Pachedu-never made noise about nid 2 evacuate people @matigary @shumbamutasa @ShingiMunyeza	displaced_people_and_evacuations
1108010538632658944	Our heartsὉ9go out to all those who have been affected by #CycloneIdai including loss of life, destruction of property &amp; displacement of people due to flooding and landslides. @WFP is supporting ongoing assessment efforts with @UNZimbabwe and stands with the people of #Zimbabwe.	displaced_people_and_evacuations
1108682295689531395	Do we know how many displaced?	displaced_people_and_evacuations
1112059723661131781	The Government of #Mozambique has officially confirmed cholera within camps for people displaced by #CycloneIdai. Daniel Timme, Chief of Communications @UNICEF_Moz tells us what UNICEF is doing to provide aid. Send help to children in need. Donate now at	displaced_people_and_evacuations
1109818182259204096	#UPDATE The powerful CAT4 #CycloneTrevor is now gone leaving massive damage, but no reported injuries &amp; deaths - thanks to the timely #evacuations. Below, evacuees are at the Royal Australian Air Force #RAAF military air base &amp; being assisted to travel back home. #CycloneIdai	displaced_people_and_evacuations
1110628888382750720	#CycloneIdai has affected more than 1.85 million people in #Mozambique. 483,000 people have been displaced by the floods. Red Cross teams are working tirelessly. #EstamosJuntos ὏7 @PunainenRisti	displaced_people_and_evacuations
1113286483891433474	Visiting accommodation centres in #Beira with Graca Machel, President of @FDC_Moz. #CycloneIdai has displaced near on 129k people from their homes; they are hosted in 161 transit centres. @UNICEF + partners are on the ground.	displaced_people_and_evacuations
1108289942990540800	@DrNkuSibanda @ZimMediaReview Exposing your ignorance once again. So you wanted Govt to evacuate the whole of Manicaland Province since the path of #CycloneIdai wasnt clear and precise!! Govt warned people beforehand through the CPU, but u are choosing to turn a blind eye on that	displaced_people_and_evacuations
1110177896793079808	RT @AP_Africa: Aid increases to thousands homeless from Mozambique cyclone, US military to help	displaced_people_and_evacuations
1107957092399415297	Severe tropical cyclone #Idai has just ripped through a city of half a million, devastating hundreds of thousands of homes and livelihoods. Yet 4 days later still barely a whisper in the global media #IdaiCyclone #Mozambique #Beira #ClimateEmergency	infrastructure_and_utility_damage
1110255893084626944	After destruction, the terrible silence. School bells always ring at 7 each morning. But in areas of Mozambique devastated by Cyclone Idai, again this Monday morning they did not. Many schools are ruined, while others are being used to shelter storm refugees.	infrastructure_and_utility_damage
1108291692787056640	Total devastation in Beira, and loss of lives, homes and crops in Zimbabwe and Malawi due #CycloneIdai. Coming at the end of the growing season and wiping out crops means the next year will be extremely tough.	infrastructure_and_utility_damage
1110894146787688457	#CycloneIdai caused not just loss of life but also loss of livelihoods. Match is harvest season and whole crops were wiped out with countless livestock drowned. Floods and winds destroyed businesses, schools, clinics, churches, roads and communications infrastructure	infrastructure_and_utility_damage
1107243421318737920	Pictures: Chirwa bus plunges into Runde river as Cyclone Idai floods continue in Chiredzi, Zimbabwe  #Zimbabwe #ChirwaBus #Chiredzi #CycloneIdai #RundeRiver #CycloneIdaiZW	infrastructure_and_utility_damage
1110815958778691584	Damage caused to an Integrated Services Center for Victims of Violence in the District of Dondo after #CycloneIdai. Assessments are ongoing - we will continue to support the Governments efforts to protect those at risk.	infrastructure_and_utility_damage
1112671103795777537	Assessing the damage caused by #CycloneIdai in Chimanimani, WFP Regional Director @LolaCastroWFP leads relief efforts in #Zimbabwe	infrastructure_and_utility_damage
1112675380954124288	Drinking water supply is up and running again in Beira #Mozambique following the failure of all electricity and communications when the devastating cyclone #Idai hit the city  @VEI_NL	infrastructure_and_utility_damage
1108818349805498368	#CycloneIdai We have engineers and we are planning to build all the damaged bridges	infrastructure_and_utility_damage
1108958919395692547	A man surveys heavy damage to the main road linking Berira, #Mozambiques 3rd largest city to the rest of the country. #Cyclone #Idai	infrastructure_and_utility_damage
1110618102537043968	The UN says Cyclone Idai destroyed at least US$1bn worth of infrastructure in Mozambique, Zim and Malawi. UN Economic Commission for Africa Executive Secretary Vera Songwe said the Beira port, key to Zimbabwe trade, is essentially today almost a thing of the past”	infrastructure_and_utility_damage
1109142309671763968	The Red Cross says cholera was reported in Beira, Mozambique, which was 90% destroyed by Cyclone Idai and where thousands of survivors face water shortages. Aid groups say 500K people still stranded or in makeshift camps are at risk of deadly disease due to lack of clean water.	infrastructure_and_utility_damage
1108045203942854656	In response to damage caused by #CycloneIdai, @AECID_ess Humanitarian Action Office has contributed €50,000 to the emergency fund activated by the Int. Federation of the Red Cross on 14 March, which includes shelter, health, water, sanitation and hygiene interventions. ὏7@ifrc	infrastructure_and_utility_damage
1107915640504008704	#CycloneIdai leaves a tail of destruction in chimanimani	infrastructure_and_utility_damage
1112076041403727872	As the effects of climate change are felt across the world, we must ensure that those countries that bear the brunt of its damage but are least able to cope are not left more indebted.	infrastructure_and_utility_damage
1108662596243210241	We cannot know how many dead. A huge, huge number. I have the impression a huge number also could be rescued if enough help is sent, right now. #CycloneIdai 5/5	injured_or_dead_people
1107192451222159360	RT @NMkapikoh: #Zimbabwe #CycloneIdai Death toll now at 31 in Manicaland Province	injured_or_dead_people
1109635821005619200	The deafening silence by SADC Secretariat on Cyclone Idai that hit Mozambique, Zimbabwe and Malawi that left many dead and destroyed lots of property is shocking. By now The Secretariat could have convene to discuss interventions. Chairman Namibia is futile and sleeping !	injured_or_dead_people
1107922695553986560	RT @UNClaireMedina: UN standing with Zimbabwe, Malawi, Mozambique as Southern Africa death toll from deadly cyclone mounts	injured_or_dead_people
1111641009610477569	RT @RT_com: Aerial footage: Aftermath of deadly Cyclone #Idai that left more than 460 dead in #Mozambique	injured_or_dead_people
1106657939694198785	Early information coming in on human tragedy tropical cyclone Idai has so far caused in Mozambique. As storm rages on, 19 dead already since it struck yesterday:	injured_or_dead_people
1108626878225661954	@nelsonchamisa is lost when he blames Gvt over #CycloneIdai deaths as reported in the @DailyNewsZim of today. This was Mother Nature full stop.	injured_or_dead_people
1109452336861249537	἟2἟F The number of people killed in #Mozambique following #Cycloneidai has almost doubled over night to 417. Could rise to over 1000. A fisherman from #Beira is doing all he can to save as many people as possible. Our story	injured_or_dead_people
1107634319890305024	President Nyusi flies over flooded areas: Official death toll climbs to 84, with 1,500 injured #Mozambique #CycloneIdai #CicloneIdai	injured_or_dead_people
1108608402157170688	Cyclone Idai death toll to pass 500, according to Zimbabwes military + 100s of bodies of missing Zimbabweans wash up in Mozambique	injured_or_dead_people
1113193975291305984	According to Mozambique Health Ministry, 1,052 cases of cholera recorded, including one death in the cyclone Idai affected areas. Of these,, 258 cases (25 per cent) were reported in the last 24 hours.	injured_or_dead_people
1109884434591989760	Officials fear that disease could exacerbate already devastating conditions in Malawi, Mozambique and Zimbabwe, where #CycloneIdai has killed more than 750 people.	injured_or_dead_people
1107974551101718528	Bikita There are 3 fatalities from collapsed buildings of which 2 are children a boy and a girl from Ward 8 and 1 was a woman from Ward 10 in Bikita District #cycloneidai	injured_or_dead_people
1109914609337753601	The official death toll from Cyclone Idai, continues to rise sharply. On Sunday, March 24, Mozambique authorities said 446 people are now confirmed dead and the figure is likely to rise further as more affected areas become accessible.	injured_or_dead_people
1107559309456695296	CYCLONE IDAI DEATH TOLL INCREASES: The new death toll from #CycloneIdai now stands at 83 in Zimbabwe with over scores not yet accounted for.	injured_or_dead_people
1111506654900772864	The @GiftoftheGivers K9 team is headed for an area in Chimanimani called Kopa. There are 39 school children missing. The search to locate their &amp; other remains begins today. Look out for my &amp; Linge’s report on @eNCA on Sat morning. #CycloneIdai #Zimbabwe ἟F἟C	missing_or_found_people
1109279458840723456	One week later, thousands of people remain missing across Mozambique, Malawi, and Zimbabwe. Millions of others across have been left destitute without food or basic services..	missing_or_found_people
1110897880787795969	To afford the missing #CycloneIdai victims a decent burial, the GVT needs to mobilise: 1. Ground Penetrating Radar 2. K-9 Unit Sniffer Dogs 3. Forensic DNA Testing We shouldnt bury them unidentified or leave others mud-trapped beneath. @InfoMinZW @fortunechasi @nickmangwana	missing_or_found_people
1109614484019130368	Where are the soldiers? This is a sick joke. The victims of the cyclone are are searching for their own dead with their bare hands. Every soldier in Manicaland should be in Chimanimani. The government is not taking this seriously. What a shame.	not_humanitarian
1108275778679115777	The prophet in me tells me someone, somewhere is already stealing the #CycloneIdai donations. Vamwe vanhu denga avapinde sure. @mhlanga_micheal @mawarirechypo @keithmoyoZW @mafortyzw	not_humanitarian
1108728648633339905	1. I hear the regime has arrested journalist @zenzele Ndebele at State House in Bulawayo where civil society groups were meeting Mnangagwa. No details of the charge at present. Lately, Zenzele has been one of the most active mobilisers of suppport for victims of #CycloneIDAI	not_humanitarian
1116257693973585923	Is it just me, but arent the photos of (aid agency) support to #CycloneIdai here on Twitter full of white saviours? Its a bit nauseating.	not_humanitarian
1107305964846440448	So they are some people who actually took their money to church today instead of helping out the victims of #CycloneIdai. #CycloneIdaiZW	not_humanitarian
1109889475843407874	I hope that we dont lose this fact in the days ahead - climate change is real and Malawians do not have the resources to cope with it on their own. They dont need people to tell them the answer but they do need help in implementing viable solutions. #Malawi	not_humanitarian
1110427936593711104	You donate food stuffs for the #CycloneIdai victims and u hear zanu is now distributing the goods to their party member only .NxAA fuck these donations zanu will make u have a savage heart ..where is Red cross n churches ? Why politicize food aid on such a national crisis ??	not_humanitarian
1107980287764582402	Nelson Chamisa traveling in a scotch cart during his tour of the Manicaland province after Cyclone Idai floods - 18 March 2019 #Zimbabwe #CycloneIdai #Chamisa	not_humanitarian
1107162128945958912	Imagine if our military resources were deployed to the affected areas prior to all this loss Zvimwe zvinongodawo pfungwa amana #CycloneIdai our gvt can do much better, they just dont care!!	not_humanitarian
1111496598327050240	The superficial and underwhelming coverage of #CycloneIdai floods in #Mozambique #Zimbabwe #Malawi a symptom of something more insidious than usual media myopia says @glendaADaniels @ConversationUK	not_humanitarian
1107881126759145472	First thing you have to ask yourself is  Bigman vane social media presence yakadii? The answer to that will help you a lot!	not_humanitarian
1116618553946296320	Civic society leaders under the banner of Civic Society and Churches Joint Forum are presenting their report after conducting a #FactFindingMission in Chimanimani to verify the allegations of unfair distribution of #CycloneIdai aid. Watch #PressConferenceFacebookLive on our page.	not_humanitarian
1110495353579675650	So which aid is alleged to have been stolen by Zanu PF? @NewsDayZimbabwe stop it !	not_humanitarian
1108299530502660099	RT @Scripture39: Their twitter account last knew the weather in January	not_humanitarian
1107824302836117504	If ballot paper can reach, this old woman, Why are rights to basic services like clean water and proper house from the gvt cannot? #Ramaphosa #TheBigDebate #CycloneIdai	not_humanitarian
1113506599870652416	ILO Team having good discussions with the Mayor of the City of Beira in Mozambique about employment intensive post cyclone Idai recovery initiatives. Time to give victims income opportunities whilst rebuilding their city with better resilience! @jonitokomusa @ilo_pretoria @ILO	other_relevant_information
1116943385636605952	As the nation comes to terms with the devastating effects of #CycloneIdai, we continue with our spirit of giving. One of the areas affected by the cyclone was Bikita in Masvingo Province.	other_relevant_information
1111331323514417152	Thank u for bringing a 1st hand experience of the supposedly ‘politicization of food aid’ to victims of #CycloneIdai. Such allegations are brought by schizophrenic opposition politicians trying to gain political mileage out of the victims’ misery. It’s despicable.	other_relevant_information
1108755176393969664	#Mozambique : No one heard victims’ cries for help as they were swept away by floods says priest  #Idai #CycloneIdai #CicloneIIdai	other_relevant_information
1115893457451671553	We are at the State House where President @edmnangagwa is hosting a roundtable meeting on #CycloneIdai infrastructure restoration in affected areas.	other_relevant_information
1108363938683650048	#CycloneIdai may be one of the worst natural disasters in the African continent since 2000. We @UNFPA offer our sincere condolences to those who lost loved ones and we are working hard to offer comfort, dignity kits, reproductive health kits, and more.	other_relevant_information
1113209235750424576	Most Revd Dr. Thabo Makgoba, the Archbishop and Metropolitan of the Anglican Church of Southern Africa was in Mozambique yesterday to visit some of the areas affected by Cyclone Idai.	other_relevant_information
1108033748736442368	RT @AlbertMbakaKE: Climate Change is Real and Mitigation efforts should be undertaken with uttermost seriousness.	other_relevant_information
1110908411795910656	Hmmm, maybe I am wrong but ZANU-PF seems to have more resources at their disposal than the government. Did you check the number of their vehicles at the #CycloneIdai hit areas? Never saw the government ones!	other_relevant_information
1108626774995464192	On #Sunrise well have the latest on the humanitarian effort in the wake of #CycloneIdai that hit Mozambique, Malawi and Zimbabwe. ⏰ Well be speaking with aid worker @RikGoverde from @save_children and activist @Dario_Camal at 7.15am	other_relevant_information
1108709656761905152	#Mozambique: residents of #Susundenga in make their way thruogh Chizizira river after bridge was broken by #cycloneIdai floods 1/5	other_relevant_information
1111245322976718848	Imagine the medicine stolen from Nemchemi to PVT pharmacies from victims of #cycloneidai #cycloneidaiZW Surely corruption should be a crime against humanity.	other_relevant_information
1109457680643641350	#cycloneIdai has exposed how women and children are vulnerable. Most men survived and the greater number of victims were children and women.	other_relevant_information
1107924778382430208	Your mans (Ed) is addressing the victims of the #cycloneidai in the comfort of hes statehouse ,for real what stopping progress in Zim is lack of leadership not sanctions. facts	other_relevant_information
1107873773636763649	Oh you are actually agreeing that there were indeed victims during the stay away? I thought you guys denied everything?	other_relevant_information
1108757047741480960	Ἑ8This is #important and #urgent! #aid has not been sufficientἙ8 #euros | #pounds | #dollars it’s the same! #emergency #mozambique #donate #help @UN ἟5἟9#Portugal ἞C἞7#UK ἞A἟A@EU_Commission Mozambique already faces difficulties without natural disasters.	requests_or_urgent_needs
1111853718927036416	Please support #CycloneIdai victims and survivors, help @adppmozambique , @dappmalawi and @dapp_zimbabwe to rebuild lives for the people in needy. Support the affected in #MozambiqueFloods2019 by donating using the crowdfunding link below!	requests_or_urgent_needs
1111253450925527040	#CycloneIdai is the worst disaster to hit southern Africa in at least two decades. An estimated 3m people, more than half of whom are children, urgently need humanitarian assistance across Malawi, Mozambique and Zimbabwe.	requests_or_urgent_needs
1112637369428176897	.@WHO has been supporting the Government of #Mozambique in co-ordinating the deployment of 21 Emergency Medical Teams that will treat populations affected by #CycloneIdai. Some of the teams are from other countries in #Africa. w/ @OMSMocambique	requests_or_urgent_needs
1109028869460426752	There is land under all that water. Roads, farms, livelihoods. Mozambique needs help. Consider supporting:  or	requests_or_urgent_needs
1112965583170088963	Video from tent distribution in #Mozambique. CARE is on the ground in Mozambique, Malawi and Zimbabwe delivering aid to communities affected by #CycloneIdai. You can help. Donate at:	requests_or_urgent_needs
1109022745155768321	#CycloneIdai Update: @USAIDs Disaster Assistance Response Team in #Mozambique identified Ἵ8️ as a priority need. Theres also limited access to Ὣ0 &amp; hygiene supplies. Were working w/ @WorldVision to provide relief supplies to ppl affected by this devastating disaster.	requests_or_urgent_needs
1108732746795503616	Cyclone Idai may be one of the worst natural disasters in the African continent since 2000. #Mozambique needs your #HELP Now.	requests_or_urgent_needs
1110225487207366656	Just over a week ago, catastrophic Cyclone Idai swept through Mozambique, Malawi and Zimbabwe. This week, flooding remains severe but rescue operations are continuing and aid is getting through. People need help now:	requests_or_urgent_needs
1111309876519673857	#CycloneIdai: More than 1.5 million children urgently need assistance across Mozambique, Malawi and Zimbabwe ▶️	requests_or_urgent_needs
1110638965923696642	At a press encounter on #CycloneIdai this morning, @antonioguterres said the people of Mozambique, Zimbabwe and Malawi will need strong, sustained support. He called on the international community to quickly and fully fund the humanitarian response:	requests_or_urgent_needs
1107920341421182976	RT @mathethando: We made a couple of impact assessment maps for the Cyclone. Tag any aid organizations who might need to see this. /	requests_or_urgent_needs
1110811593774903298	Phenomenal outpouring of aid on the ground in Mozambique and Zimbabwe in the tragic wake of #CycloneIdai. Emergency workers, shelters, generators, hygiene kits, food, totaling up to 20 tonnes of airdrops and over £22 million in #UKAid — all to help those most in need.	requests_or_urgent_needs
1108441746487365632	I think it’s been photoshopped they were carrying bags of food for those in need.	requests_or_urgent_needs
1107521735937744897	Calling all corporates, investors &amp; institutions to come to aid in Zimbabwe. The deadly #CycloneIdai has kills more than 70 &amp; displaced thousands. #CSR @ZNCCNational @ZimTradeAlerts @africanroundup @CRSnews @UNZimbabwe @HigherLifeFDN	requests_or_urgent_needs
1109144501430288384	Thank you CBN for helping us spread the news of the disaster relief efforts in Mozambique after we were hit by Cyclone Idai ! We are so thankful for the body of Christ uniting in this hour for those in desperate need in our nation!	rescue_volunteering_or_donation_effort
1117055941806055426	We are excited to have our gorgeous @MboMahocs partake in #thenextmile #CycloneIdai donations with the Masiyiwa Sisters, @MapsMaponyane and many more in Chimanini, Zimbabwe ἟F἟C	rescue_volunteering_or_donation_effort
1111979712203681792	No respite for the @UNICEF Supply &amp; Logistics staff on the ground in #Mozambique where about 1.8 million people, one million being #children have been affected by #CycloneIdai. A race against time to help &amp; protect them from water-born diseases and malnutrition. #ForEveryChild	rescue_volunteering_or_donation_effort
1109141833395904514	#Vatican announces that Pope Francis has made an initial contribution of 150,000 Euro to relief efforts in Mozambique, Zimbabwe and Malawi after devastating effects of tropical cyclone Idai	rescue_volunteering_or_donation_effort
1117420040842825730	#CycloneIdai Aftermath shocking Images ὢAὤF Thank you to those sending prayers to the family who lost their relatives and who are providing help in form of food , cloths etc ὄFὄFὄF @chengeh1 @DicommMcCann @belindaholman11 @HigherLifeFDN @econetzimbabwe @elevateyouthzw #RT	rescue_volunteering_or_donation_effort
