tweet_id	tweet_text	class_label
1108088233785782273	Am I the only one who have seen the overwhelming response in donations to help #CycloneIdai victims? If we can do this fellow Zimbabweans this country will never be the same! what causes toxicity in the corridors and streets? @TrevorNcube @ShingiMunyeza @zvobgoluckson1 @Mamoxn	rescue_volunteering_or_donation_effort
1113354847728881664	We met these children at a food distribution point in Ngangu-one of the hardest hit areas by #CycloneIdai in #Zim Amidst the grim scenes of devastation surrounding them they choose to be hopeful. Your donations turn their hope into reality. Donate today:	rescue_volunteering_or_donation_effort
1107334269733691393	Veduwe please musadye mari dzema donations for #CycloneIdai send your donations to reliable entities vanosvitsa help	rescue_volunteering_or_donation_effort
1108276062499360768	#Onthemove. @WFP teams worked late last night to get everything ready to send high-energy biscuits and water bottles by helicopter this morning from #Beira to #Bozi, #Mozambique affected by #CycloneIdai.	rescue_volunteering_or_donation_effort
1108320728678584322	Mrs Fungai Chiyeza speaks on her experience surviving #CycloneIdai. If you want to donate to victims of #CycloneIdai, you may drop off your donations at 7 Kenilworth Road, Newlands, Harare or any of the pick up points around the country. #ZiFMCares @chengem75 @ZiFMNews	rescue_volunteering_or_donation_effort
1111577724529856516	With UNICEF support over 1,855 children and 1,200 caregivers affected by #CycloneIdai have been reached with psychosocial support through 32 social workers. This includes Pauline (13) and Tatenda (9), who lost their family in Fridays mud and rubble-stream in Ngangu.	rescue_volunteering_or_donation_effort
1107323247857590272	In times of crisis like this we must all come together to provide relief, serve lives and give hope and encouragement. Dont ask what others are doing but look at yourself and ask: What can l do to help my compatriots. #CycloneIdai #PamberiNeZimbabwe	rescue_volunteering_or_donation_effort
1110563896568487939	The scale of the flooding caused by the storm is immense. @WFP has been mobilizing since before it hit, and we are working w/govt and Mozambican people to get life-saving assistance to those affected. #CycloneIdai	rescue_volunteering_or_donation_effort
1107983680440598528	ZIMBABWE NATIONAL ARMY DISTRIBUTING FOOD AID: The Zimbabwe National Army (ZNA) has been on the ground &amp; distributing food aid to #CycloneIdai vicitims in Chimanimani since Monday. There was initial backlash from Zimbabweans on social media who blamed govt for late response.	rescue_volunteering_or_donation_effort
1107147469794611200	@edmnangagwa Dzokai Murambwi, kwaipa kuno. This is the saddest moment being witnessed and experience after the 1980, zvatowedzera nhamo. Thanks President for deploying the soldiers to assist. Asi zvava kuda baba vomusha varipo it’s now a trend that soldiers are deployed musipo!	rescue_volunteering_or_donation_effort
1107170730876248064	As gather to praise the Lord please make time to pray for families affected by #CycloneIdai. Also take note of the some relief projects going on. We need to all hands on deck to support our brothers &amp; sisters in trouble.	sympathy_and_support
1106818252590718976	To the people of Mozambique and other affected countries may God comfort you during this difficult period. Youre in my prayers. #CycloneIdai #healtheworld	sympathy_and_support
1106922554646769664	My thoughts and prayers are with the families and all those affected by #CycloneIdai. Prayers for the people of Mozambique, Malawi and Zimbabwe. What a sad monthὢ2ὢ2ὢ2ὢ2.	sympathy_and_support
1107525755158908928	Its absolutely true that now is the time to unite &amp; help victims of #CycloneIdai. However, there are important questions that still need to be answered about why we are not prepared for disaster. The accountability convo MUST be had if we are to avoid the same in future.	sympathy_and_support
1107920249779826688	I just find it astonishing that a devastating human tragedy like this isnt leading every news bulliten. My thoughts are with everyone caught up in this terrible disaster.	sympathy_and_support
1110894379026255873	@jeigh_wabantu We should draw lessons from the disaster @edmnangagwa Our thoughts and prayers are with the victims of Battlefields and #CycloneIdai We will setup a commission of inquiry to find out what happened	sympathy_and_support
1107500409655119872	@econet_support @econetzimbabwe @ZBCNewsonline #CycloneIDAI #donation deepest condolences to families which lost their loved ones in Chimanimani floods ὣ0ὣ0 ,feel sorry for those who were left homeless. Donations to the nearest econet shop will surely make a difference	sympathy_and_support
1106874091129180161	@wasudigital Our prayers are with all those affected #Cycloneidai	sympathy_and_support
1107496324247810049	It’s been heartbreaking watching the trail of disaster left by #cycloneIDAI in the homeland, #Zimbabwe #Mozambique. Thoughts and prayers with everyone affected, both directly or indirectly.	sympathy_and_support
1109749251179982849	#CycloneIdai is said to have claimed more than 700 lives and caused unprecedented destruction. As South Africans, we must reach out to our neighbours, many of whom will become refugees. We must help them regain a sense of home. @Refugees #Mozambique #zimbabwe #malawi #africaunite	sympathy_and_support
1107824579865726977	Our condolences to all the families that were affected by #CycloneIdai . As Young people fighting #ClimateChange this has been a work up call and we have been challenged to do more work with your support @UNDPZimbabwe @FAOclimate @unv @hivosrosa @METHI_Zimbabwe	sympathy_and_support
1107863158012739584	There will always be other people who need your help and assistance. That is what it means to be human #TuesdayThoughts #CycloneIdaiZW #cycloneidai	sympathy_and_support
1108273555035381760	Its with extreme sadness that we observe the devastating effect of #CycloneIdai in #Beira city &amp; surroundings. We are deeply in solidarity with the entire population affected and reiterate our commitment to continue to support #Mozambiques development. #MozambiqueFloods2019	sympathy_and_support
1109702879257001984	There is going be a minute of silence at the NSS before kickoff in honour of #CycloneIdaiZW victims. Players will also put on black armbands #GoWarriorsGo #cycloneIDAI	sympathy_and_support
1109466957479399425	It is one thing to have survived through a natural disaster, it’s another thing to deal with the trauma after. I pray and hope that funds will be raised to help with the #mentalhealth of those affected by #cycloneidai	sympathy_and_support
