tweet_id	tweet_text	class_label
1107223918321037313	Tropical Cyclone #Idai has wreaked havoc in #Mozambique #Zimbabwe and #Malawi Our @CopernicusEMS #RapidMappingTeam is producing emergency maps to support first responders and relief management planners Here is its path as seen by #Sentinel3 ἞A἟AὯ0	caution_and_advice
1106822789808443392	RT @Fly_Airlink: Beira airport remains closed today by Mozambique authorities due to the impact of cyclone IDAI. Updates to follow.	caution_and_advice
1113073066131800064	Disease outbreaks: INGC maps potential risk areas in Sofala – #Mozambique  #Floods #CycloneIdai	caution_and_advice
1111162425225691136	With support from @USAID Zimbabwe GOAL will supply water purification chemicals and soap to affected households to prevent disease outbreaks such as cholera. Find basic cholera prevention steps from @CDCgov here:  #CycloneIdai	caution_and_advice
1107189135046049792	#WARNING #ALERT #CycloneIdai DONATE WISELY, beware of thieves acting as good Samaritans. Follow donation information Only from reliable sources.	caution_and_advice
1107926439448506369	Never walk, swim, drive through flood water or venture into unsafe/ disused mine shafts, report any missing persons to police as soon as it is practical to do so. In case of emergency dial 112 or 111. #cpu #CycloneIdai	caution_and_advice
1108235420003979264	Mozambique, Malawi, Zimbabwe, #CycloneIdai has created inland oceans running for mile after mile, with water above tree-level says @WFP on the ground @UNOCHA @WHO. Emergency bigger by the hour.	caution_and_advice
1106963831425810440	#CycloneIdai update. The system is not tropical cyclone strength anymore and is therefore now referred to as Ex-Idai. However, more heavy rainfall and flooding are expected in #Zimbabwe and #Mozambique. Here are the details:	caution_and_advice
1106736588711698433	Chief Meteorological officer for Manicaland Lucas Murambi says #CycloneIdai is only expected to arrive in Zimbabwe later tonight. Mutasa District and other north western parts of Manicaland are the highest risk areas although the cyclone could change direction at any point.	caution_and_advice
1106949665684099074	2/2 Encouraged by some on the ground responses to #CycloneIdai e.g schools in #Malawi being converted to emergency shelters” , temporary toilets erected.. helicopters airlifting people .. appeals for donations launched.. May we #SeeInvisibleGirls	caution_and_advice
1113000261138690048	The number of cholera cases in #Mozambique following #CycloneIdai continues to rise. #UKaid is playing a crucial role on the ground - providing 5 medical experts working with @WHO on the coordination of healthcare including cholera treatment + a vaccination campaign	caution_and_advice
1108039777641816064	#CycloneIdai response currently underway in Malawi. Response plans will extend to all affected Southern Africa countries. @Oxfam @UNZimbabwe @cgtnafrica @OxfamMalawi #TogetherWeCan	caution_and_advice
1108942033425580032	A child is transported on a fridge during floods after Cyclone Idai in Buzi, Mozambique. More images of the devastation:  ὏7 @SibekoS	displaced_people_and_evacuations
1112059723661131781	The Government of #Mozambique has officially confirmed cholera within camps for people displaced by #CycloneIdai. Daniel Timme, Chief of Communications @UNICEF_Moz tells us what UNICEF is doing to provide aid. Send help to children in need. Donate now at	displaced_people_and_evacuations
1109190391553769472	We do not have anywhere to stay. I live with my 4 sisters &amp; I am the 5th child. We are 6 of us including mother. I wish we find somewhere safe to sleep. As a young woman I do feel safe to live here because there are many people here, Felistas says #CycloneIdai survivor	displaced_people_and_evacuations
1108765426517975041	I refuse to believe that my government didnt evacuate #Zimbabweans from #cycloneIdai prone areas because of the opposition.	displaced_people_and_evacuations
1111659060435304448	Mozambican president visiting accommodation camps for people displaced by floods following #cycloneIdai. People complained about delays and insufficient food distribution in the camps.	displaced_people_and_evacuations
1106941332558217216	An estimated 600,000 people in #Mozambique have been affected by cyclone Idai; 260,000 are children. Thousands are displaced, their houses destroyed by the severe weather. We’re on the ground. #MozambiqueFloods2019	displaced_people_and_evacuations
1108207826911014912	#Mozambique at #Buzi bridge /River at #Espungabera area on Saturday 16/3 river flooded after heavy rain in Zimbabwe-Mozambique sides due to #CycloneIdai - on way to Beira water has taken away lives, displaced thousands and wrecked havoc	displaced_people_and_evacuations
1107676818868527106	@jct_org I am sure the authorities and @MSDZIM were aware of #CycloneIdai and could have called for the evacuation of people from these areas before it was too late.	displaced_people_and_evacuations
1108659050877734913	#UNFPA #Mozambique is thrilled to distribute Dignity Kits to new mothers and women displaced from their homes by the floods in Tete Province. More on the way for those impacted by Cyclone Idai.	displaced_people_and_evacuations
1116253945104621568	@MultiChoice Chris Charamba, Content Creation Manager of Hallelujah Mag highlighted the devastation in areas such as Chimanimani; Thousands of families have been displaced, they’ve lost their loved ones, possessions and the basic items that make life humane. #DonateSaveALifeZW #CycloneIdai	displaced_people_and_evacuations
1108024180048568321	Nhamatanda-Beira road: Detours to guarantee assistance to displaced people to be opened  #Mozambique #Idai #CycloneIdai #CicloneIdai	displaced_people_and_evacuations
1116033021466038272	Our pilots in #Zimbabwe are working overtime doing medical evacuations due to a malaria outbreak in #Chimanimani -one of the ravaged areas by #CycloneIdai. Most of the affected are children&amp; pregnant women. Let our giving pool not run dry. Donate today:	displaced_people_and_evacuations
1109833139210334208	The ministry has confused operatives. Tweeting about evacuation(rural folk will not see) instead of deploying soldiers to lead the process of informing residents of the seriousness of the warning. Acting like they gave free gadgets &amp; data during the campaign in place of regalia	displaced_people_and_evacuations
1110177896793079808	RT @AP_Africa: Aid increases to thousands homeless from Mozambique cyclone, US military to help	displaced_people_and_evacuations
1108289942990540800	@DrNkuSibanda @ZimMediaReview Exposing your ignorance once again. So you wanted Govt to evacuate the whole of Manicaland Province since the path of #CycloneIdai wasnt clear and precise!! Govt warned people beforehand through the CPU, but u are choosing to turn a blind eye on that	displaced_people_and_evacuations
1111936780113244160	Homes were destroyed by #CycloneIdai. Our first cargo for today are tents which will provide shelter for the affected people. Our Regional Director and Country Director will be assessing the affected areas to help us come up with a long term recovery plan.	infrastructure_and_utility_damage
1108128119880331264	@shumbamutasa @nelsonchamisa @drnmanyika Report from Beira 1/ On the 14th March the Central regional of Mozambique and most particularly the city of Beira were heavily affected by Cyclone IDAI. There has been extensive wind and water damage to the city and surrounding area with loss of lives, property	infrastructure_and_utility_damage
1112065174868058112	RT @KBMpofu: Things we lost in the floods #cycloneidai #Zimbabwe	infrastructure_and_utility_damage
1108120689222008832	After all the efforts that everybody does, having good roads, good markets, places, development etc Beira has been COMPLETELY DESTROYED by IDAI cyclone Catastrophic night ὢD 14-march-2019 we should all PRAY FOR BEIRAὢD so sadὢD	infrastructure_and_utility_damage
1106857205339471872	@ali_naka @nickmangwana Will speak for my colleague @mabhugu and I, hv been sharing information on #CycloneIdai on our show..more expert dissemination of info needed too frm Met Dept,civil protection unit etc.Sadly a lot of destruction hs been experienced in areas like Chimamimani(disaster mgt policy)	infrastructure_and_utility_damage
1107467962120896512	Surprisingly remnants of Cyclone Idai made huge damage in #Zimbabwe after large disaster in #Mozambique. It looks the communities in this part of the world are not used to this negative product of Climate Change #CycloneIdai #ClimateChange #ClimateResilience #Idai #Storm #Climate	infrastructure_and_utility_damage
1107664390185193472	RT @AshiraiM: Property all destroyed #cycloneidai #cycloneidaiZW	infrastructure_and_utility_damage
1107508036736897024	Chimanimani the worst #CycloneIdai affected area in Zimbabwe is desperate for humanitarian assistance. The area is inaccessible. Bridges are collapsing &amp; air rescue by helicopters is being hampered by bad weather. Reports say 65 pple are confirmed dead &amp; dozens are missing.	infrastructure_and_utility_damage
1108240631342813184	In Beira/Mozambique, #CycloneIdai has destroyed up to 90% of all buildings and infrastructure have been destroyed and hundreds are feared to have died. Find out how you can help support the humanitarian relief effort:  #CycloneIdai	infrastructure_and_utility_damage
1107896028915744770	Cyclone Idai has reportedly destroyed nearly 90% of the Mozambican port city of Beira	infrastructure_and_utility_damage
1107021495434469382	Terribly sad news, lives lost &amp; damage caused by #CycloneIdai in Eastern #Zimbabwe. Were following closely with partners on the ground. ἞C἞7 is supporting those affected in ἟2἟F &amp; stands ready to support in ἟F἟Cwhere we can. Thoughts &amp; prayers for those affected Ὁ4 @UKinZimbabwe	infrastructure_and_utility_damage
1107899480211419136	~36 hours after the landfall of Cyclone #Idai — what the @WMO called a potential worst case scenario” — these are some of the first photos of Beira, Mozambique, a city that is still largely cut off from the rest of the world by flooding. A growing humanitarian catastrophe.	infrastructure_and_utility_damage
1106903168577880064	PICTURES: Chimanimani Houses Destroyed By Cyclone Idai ἟F἟C #Zimbabwe #津巴布韦 #CycloneIdai #Africa	infrastructure_and_utility_damage
1107979604382400513	RT @AFPphoto: ἟2἟F Mozambique city Beira 90% damaged or destroyed by cyclone #AFP	infrastructure_and_utility_damage
1107581457374031872	Our @theIRC teams here in #Zimbabwe are trying to reach the communities affected by #CycloneIDAI but the infrastructure damage is severe and our teams couldn’t reach Chimanimani nor Chipinge. Urgent road repairs in progress, so we’ll try again in the morning.	infrastructure_and_utility_damage
1106989880763207681	#IntheNews Mozambique, Zimbabwe and Malawi have been hit by a vicious cyclone that has killed nearly 150 people, left hundreds more missing and stranded tens of thousands who are cut off from roads and telephones in mainly poor, rural areas.	injured_or_dead_people
1107467668263714821	Mozambique: •The death toll from #CycloneIdai landfall has reportedly risen to at least 48. •Authorities have issued a Red Alert for flooding along the River Buzi, with a high risk of floods in Buzi and Pungoé. More on the Flash Update 3:	injured_or_dead_people
1108380144488628229	#CycloneIdai could be the worst such disaster to hit the southern hemisphere. Mozambique declares state of emergency, three days of national mourning starting today. Death toll surges to more than 200.	injured_or_dead_people
1108227041126727681	὆4 126 people have been killed ⛺ 80,000 people displaced Cyclone Idai has affected over 1 million people. We are working with local partners in Malawi &amp; Zimbabwe to provide emergency assistance. Stand with us and donate:	injured_or_dead_people
1106905250420670465	At least 43 dead in Mozambique and Zimbabwe as tropical cyclone Idai continues its destruction in the region.  via @business	injured_or_dead_people
1107321633491116033	Am l the only who is not feeling these cyclone jokes?, people are dead, people have lost their homes and property but we have time for jokes really?, call me old fashioned or whatever but l feel like its way too soon. #CycloneIdai Praying for all victims ὤF	injured_or_dead_people
1108464806795923456	Cyclone Idai hit Malawi, Mozambique, and Zimbabwe and the death toll is at 200+ and still rising. These countries are very poor, and a cyclone of this magnitude only pushes these countries farther away from development. Consider donating to the UNICEF USA. #CycloneIdai	injured_or_dead_people
1106492477043867649	RT @News24: Cyclone Idai makes landfall in Mozambique, dozens already killed | @Duncan025	injured_or_dead_people
1107559309456695296	CYCLONE IDAI DEATH TOLL INCREASES: The new death toll from #CycloneIdai now stands at 83 in Zimbabwe with over scores not yet accounted for.	injured_or_dead_people
1107231669126352896	RT @MaS1banda: Cyclone Idai has killed 40+ in Mozambique &amp; Zimbabwe, and has also affected Malawi. Hundreds stranded. Properties and fields	injured_or_dead_people
1107937549446729728	Mozambique Cyclone Idai death toll could exceed 1,000, says president #CycloneIdai	injured_or_dead_people
1107331913549836288	RT @InfoMinZW: Visibility has now improved and the AFZ helicopters are now ferrying the injured for medical care #CycloneIdai	injured_or_dead_people
1117738346703282176	Cyclone Idais death toll over 1000, hundreds of thousands displaced: MAPUTO, April 15 (Reuters) - Hundreds of thousands of people are still in need of aid after Cyclone Idai battered Mozambique, Zimbabwe and Malawi	injured_or_dead_people
1111747713694081026	RT @tictoc: After #CycloneIdai killed more than 460 people, cases of cholera are cropping up in its wake	injured_or_dead_people
1106834147450998784	Cyclone #Idai is dumping more water and bringing destruction to areas where scores of people have already been killed and tens of thousands displaced by #floods over the past week in #Mozambique. Communications poor with affected areas. #ResilienceForAll	injured_or_dead_people
1108821553410654210	We fear hundreds are missing after #CycloneIdai left a trail of destruction across Mozambique, Malawi and Zimbabwe. We’re helping families find their missing loved ones. Search our site in English and Portuguese:	missing_or_found_people
1108373084145418240	#CycloneIdai: 500 still missing as rescue efforts continue	missing_or_found_people
1108286363596664834	Hundreds are dead, many more are missing and thousands are now at risk from massive #flooding in Mozambique, Zimbabwe and Malawi caused by Cyclone Idai and persistent rains. #CycloneIdai	missing_or_found_people
1116674700854407169	Last week, this woman was accusing the media of spreading falshoods on #CycloneIdai relief #looting. She was later #arrested for #looting &amp; has been #remanded further to 17 April. She is Christine Chideme - a deputy director in the Ministry of Womens Affairs. @transparencyzim	not_humanitarian
1109737980418314240	I am sorry to hear this,kuomboka is one of the most impressive events I have ever attended.But this tells also of worrying low levels, like also in Kariba, of upstream Zambezi, while at the same time we have the #Cycloneidai induced floods in the east. #climatechange	not_humanitarian
1108107181491142656	Kagame wont declare war on anything, You start the nonsense he takes you out, no one will dare try it again. Stealing donations? Africans, we are better than this	not_humanitarian
1107207738847838208	It’s futile trying to blame the government. They don’t care. Playing the blame game is so useless no solutions come out of that.However if we are to play the blame game let’s introspect. What did WE as citizens do before disaster hit to assist those affected by #CycloneIdai	not_humanitarian
1108007296657997825	And then clever corporates that are receiving donations from the public in the name of #CycloneIdai victims but they will never tell us what they as a corporate donated. Hello AFRICANS ὠ2ὠ2ὠ2	not_humanitarian
1107560374524657665	The magnitude of the cyclone should`ve prompted the responsible authorities to act or at least firmly warn people so that those that could,would move to safer areas or be with their relatives elsewhere.Anyway now its a little too late for all that. #CycloneIdaiZW	not_humanitarian
1110445973652807680	Why is food donated for cyclone Idai victims now being politicised @edmnangagwa #CycloneIdaiZW	not_humanitarian
1109021207959990272	@DrNkuSibanda @edmnangagwa Iwe utori murwere. Wats this we hear that u wanted the number of #cycloneIdai deaths in Zimbabwe to be high so that u cud bitch and moan about it. Disgusting	not_humanitarian
1111496598327050240	The superficial and underwhelming coverage of #CycloneIdai floods in #Mozambique #Zimbabwe #Malawi a symptom of something more insidious than usual media myopia says @glendaADaniels @ConversationUK	not_humanitarian
1111337397550268417	@giftsiziba93 @Wamagaisa @DougColtart @advocatemahere @cdesetfree @hwendec @BvondoChidziva ARMCHAIR critics from the leafy suburbs of Harare are now in the forefront of spreading heresy &amp; blatant lies to cause confusion &amp; despondency on the distribution of relief aid to the victims of #CycloneIdai. I challenge them to go to Ngangu &amp; Copa to assist. @CharityMaodza	not_humanitarian
1111250276772708352	With all due respect Sir and for the sake of the victims, its better to just keep quite. Do you honestly think they`ll let you see it?	not_humanitarian
1107552014534234112	Mnangagwa shouldnt have flown to the UAE in the first place because #CycloneIdai was already wrecking havoc!! It was irresponsible of him to fly to the UAE at a time like this. Now hes flying home to do some damage control? Useless, wicked dictator!! ὄ7ἿFὄ7ἿF	not_humanitarian
1107881126759145472	First thing you have to ask yourself is  Bigman vane social media presence yakadii? The answer to that will help you a lot!	not_humanitarian
1113355385480650752	It breaks my heart to see children – the next generation we all talk so much about – living in the ruins of displacement centres, out of school and now at risk from killer diseases that thrive in chaos.”- @WorldVisions Antonio Matimbe on #CycloneIdai	not_humanitarian
1108221728935813121	Is this the peoples party or another useless party that does not appreciate voluntary social responsibility by its citizens to victims of underprivileged	not_humanitarian
1111331323514417152	Thank u for bringing a 1st hand experience of the supposedly ‘politicization of food aid’ to victims of #CycloneIdai. Such allegations are brought by schizophrenic opposition politicians trying to gain political mileage out of the victims’ misery. It’s despicable.	other_relevant_information
1108617921742454787	Hatidi kunzwa kuti pane afa ne zhara. Chikafu chiripo chinokwana munhu wese./ We dont want to hear of reports of people dying of hunger. Government has availed enough food for everyone - President ED Mnangagwa #Chimanimani #CycloneIdai	other_relevant_information
1108055144082665475	Mozambique braced for more flooding from Cyclone Idai as relief workers struggled to deal with the devastation wrought by one of southern Africa’s most powerful recorded storms	other_relevant_information
1115662804919431169	#Mozambique: #Malaria claims 655 lives in 2019 Q1. Wondering about all the unreported cases and how the #floodwaters of #cycloneidai are going to push this trend up in Q2-4.	other_relevant_information
1107973017961971712	[Pictures] Aerial view of Chimanimani after Cyclone Idai floods in Zimbabwe  #CycloneIdai #Chimanimani #Zimbabwe #CycloneIdaiZW	other_relevant_information
1111000717622415361	RT @WorldVisionZim: Scores of #CycloneIDAI survivors crossing Rusitu river to collect food items from the other side.	other_relevant_information
1110594356040396800	#Xenophobia To think a week ago we were all on solidarity with our fellow #CycloneIdai victims &amp; #PrayForMalawi #PrayForMozambique &amp; #PrayForZimbabwe was trending ,if the scenes happening in #Durban South Africa are true its really sad that Africans cant unite for once!	other_relevant_information
1108739046271000577	@ICRC and @CruzVermelhaMOZ (Mozambique Red Cross) Restoring Family Links for Cyclone IDAI can be found online here:	other_relevant_information
1107192674749169664	Emergency Ὢ8 readiness is key to successfully dealing with natural disasters and ensuring lives are not unnecessarily lost @InfoMinZW, we knew the #CycloneIdai was on the way, what did we do to ensure readiness to assist? What did cabinet decide on all ministries involved?	other_relevant_information
1107612910837215234	Current situation in the Manicaland province after Cyclone Idai floods in Zimbabwe #CycloneIdai #Manicaland #Chimanimani #Zimbabwe #Chipinge #CycloneIdaiZW	other_relevant_information
1107277539792338944	Guys ngatiite serious. Citizens have already reported washing away of bridges and where were these people driving to? Was this a publicity stunt in the midst of a disaster of such magnitude?? Ndapota itai serious murivanhu vekuziva imimi	other_relevant_information
1110980696204554240	This week first distributions to Dondo #Mozambique went out! #CARE teams set up tents and distributed hygiene kits to make sure uprooted families stay safe + healthy. Trucks are being loaded for further distributions tomorrow #CycloneIdai #Idai #COSACA #UKAID	other_relevant_information
1108832959086383105	Amid Mueller craziness, Cyclone Idais havoc is getting too little attention ~1 million people affected in Southern Africa and as many as 1.7 million may need assistance in Mozambique alone Trump slashed aid budget, which will hinder assistance efforts.	other_relevant_information
1110957348795924490	The Zimbabwe gvnmnt is paying civilians at a 1:1 (RTGS:U$D) rate but their parastatals are rating U$D:RTGS at 1:2,5 @TelOneZW is the latest to join this ongoing injustice. 250% fuel hyperinflation, illusive 1:1, cycloneIdai aid corruption, what will outrage ZW to boiling point?	other_relevant_information
1110695610045399042	RT @qzafrica: The destruction of Cyclone Idai in Mozambique, seen from above  via @qzafrica	other_relevant_information
1111067190650900480	Latest thoughts on biz, nutrition + #Mozambique #cycloneidai 1) once OCHA have set asks to global biz (like with Ebola) we spread the word 2) our @SBNMozambique SMEs are hit, bad. Need help to survey them. They’ll need grants plus technical support. DM me with help/ideas please!	requests_or_urgent_needs
1108687775795200000	God, I hope the people in need are getting the aid being delivered, I want to trust my people #CycloneIdai	requests_or_urgent_needs
1109322734541172737	Urgent International help needed. Millions have no food, no blanket, nothing. Soon will have health crises because already fragile infrastructure was destroyed: Mozambique Cyclone Rescuers Struggle to Reach Victims in ‘Inland Ocean’	requests_or_urgent_needs
1108990949571641344	#Beira mayor states main needs as food, water, sanitation and zinc roofing sheets to replace those blown off so many houses. Which agencies are providing these things? #CycloneIdai	requests_or_urgent_needs
1108315317204328453	#CycloneIdai has united the nation yet one thinks when is not around people mustnt eat. Food is a basic need. Even Maslow noted this. Children need to eat. Now breastfeeding mothers cant produce milk as they do not have nutrients to digest. One has put a pause till tomorrow	requests_or_urgent_needs
1110225487207366656	Just over a week ago, catastrophic Cyclone Idai swept through Mozambique, Malawi and Zimbabwe. This week, flooding remains severe but rescue operations are continuing and aid is getting through. People need help now:	requests_or_urgent_needs
1108732746795503616	Cyclone Idai may be one of the worst natural disasters in the African continent since 2000. #Mozambique needs your #HELP Now.	requests_or_urgent_needs
1110652963448598528	Mozambique: US$281.7M urgently needed to ramp up relief operations in response to #CycloneIdai	requests_or_urgent_needs
1109323550568136704	At least 500,000 people are waiting for food and water in Mozambique after Cyclone Idai hit Southern Africa and almost wiped out the city of Beira.	requests_or_urgent_needs
1109360395641339904	In central Mozambique, 1.8 million people are in urgent need of humanitarian assistance, 900,000 of them are children. Help and Donate to #cycloneIDAI emergency response at	requests_or_urgent_needs
1107546210204876804	RT @zenzele: Anyone with 20litres of Petrol please help. #CycloneIdai #Asakhe	requests_or_urgent_needs
1110919479834365963	If you can please drop by and help sort out cloths ,we low on volunteers, and there is still much work to be done. #CycloneIdai #CycloneIdaiZW @263Chat @DougColtart @kubatana @malawicoffee @WildAfricanBoy	requests_or_urgent_needs
1109656953154879488	I want books, pens, food and more tents for us to have a home. My mother was only given 1 tent but it’s not enough for all of us because my family consists of 2 boys, 2 girls and my mother.”- Farai, 12yrs #zimbabwe #CycloneIdai	requests_or_urgent_needs
1112637369428176897	.@WHO has been supporting the Government of #Mozambique in co-ordinating the deployment of 21 Emergency Medical Teams that will treat populations affected by #CycloneIdai. Some of the teams are from other countries in #Africa. w/ @OMSMocambique	requests_or_urgent_needs
1111253450925527040	#CycloneIdai is the worst disaster to hit southern Africa in at least two decades. An estimated 3m people, more than half of whom are children, urgently need humanitarian assistance across Malawi, Mozambique and Zimbabwe.	requests_or_urgent_needs
