tweet_id	tweet_text	class_label
1107673577879416833	As a nation we have been thrown into sadness by the loss of lives in the EasternHighlands caused by #CycloneIdai. Quite a number of people have been left homeless by this disaster &amp; as MAZ we are mobilising resources to assist those affected. Come through with anything you have.	rescue_volunteering_or_donation_effort
1117299819381493761	#3rdODI | SUPER SUNDAY: All roads lead to Harare Sports Club as @ZimCricketv seek to wrap up series while @EmiratesCricket will be out to stay alive! Remember all proceeds from this match go towards #CycloneIdai relief efforts #ZIMvUAE #FillUpHSC	rescue_volunteering_or_donation_effort
1110185436499058689	Thank you HR and Marketing professionals for the donations #CycloneIdai	rescue_volunteering_or_donation_effort
1108252369559654400	Part of the consignment from @SaveChildrenZIM to families affected by #CycloneIdai in #Chimanimani. We have blankets, plastic buckets, gerry cans, cooking oil, laundry &amp; bath soap, maize meal, dried kapenta, water treatment chemicals &amp; sanitary pads. @ReddBarna	rescue_volunteering_or_donation_effort
1111324067565629445	Over 1,000 households in #Zimbabwe have received food kits from us this past two weeks. Follow our work in Zimbabwe and #Malawi as we deal with the aftermath of #CycloneIdai	rescue_volunteering_or_donation_effort
1116302110642114560	Thank you @SofiaCalltorp for being on the ground today - and for making use of the @euinzim-funded @WFP_Zimbabwe helicopter, which helps us all to get the desperately needed relief goods to those still cut off after @CycloneIdai	rescue_volunteering_or_donation_effort
1108612801126457351	#Mozambique is facing its worst humanitarian crisis in recent history. Thousands have lost everything to #CycloneIdai. Please donate NOW to help:	rescue_volunteering_or_donation_effort
1111137540046766080	RT @InfoMinZW: Govt has released another $50m, making it $100M for #cycloneidai relief effort and other related support needs /	rescue_volunteering_or_donation_effort
1117694811807649792	IOM Regional Director for Southern Africa Charles Kwenin + IOM Mozambique Chief of Mission Katharina Schnoering visited Beira to review challenges + progress of the #CycloneIdai response effort. They visited accommodation centers + affected communities + met humanitarian partners	rescue_volunteering_or_donation_effort
1111137629725229056	Dear Robert &amp; Grace Mugabe if you don’t mind donating to #Cycloneidai from our hidden wealth you amassed for the past 38 YearsὤF Botswanas former Pres Ian Khama has donated 200blankets &amp; 50 tents to Mozambique &amp; Zimbabwe to provide humanitarian aid to victims of Cyclone Idai	rescue_volunteering_or_donation_effort
1109144501430288384	Thank you CBN for helping us spread the news of the disaster relief efforts in Mozambique after we were hit by Cyclone Idai ! We are so thankful for the body of Christ uniting in this hour for those in desperate need in our nation!	rescue_volunteering_or_donation_effort
1113512838772002816	Thanks to programmes funded by @eu_echo and @belgiummfa last year, response teams are using #WFPdrones in the aftermath of #CycloneIdai to assess damage &amp; give first responders a clearer picture of some of the challenges that lie ahead - when every minute counts! ἞7἞A἞A἟A἟2἟F	rescue_volunteering_or_donation_effort
1106980362763280385	#CycloneIdai is reportedly changing course and it might hit Masvingo. Sad thing is, a District Admin issued an order barring a lot of NGOs from conducting their work there and the NGOs are the most active participants of the rescue efforts rn. Ksazobalit	rescue_volunteering_or_donation_effort
1110448868368572419	Ordinary citizens,churches, NGOs, pvt companies and bzns pple are very busy donating e litle dey hve 2 help our fellow brothers &amp; sisters who are e vctims of @cycloneidai but the politicians hve grabbed those donations &amp; distributions are nw politicizd &amp; gven along plitical lines	rescue_volunteering_or_donation_effort
1116313268740612096	Our Managing Director @SamMatsekete and Head of Customer Service and Corporate Affairs @ShingiRugs hand over the truckloads of donations which include blankets, diapers, various groceries, dry foodstuff, clothing, shoes and so much more to benefit the #CycloneIdai victims.	rescue_volunteering_or_donation_effort
1112675021321916416	Thanks for the good hand, together we will accomplish. We share the same grief and sorrow with the affected families and communities.	sympathy_and_support
1106885834383523840	RT @FlowaManuh: Our prayers and thoughts are with the people in Manicaland.Its a sad situation.May we have contacts where we can drop donat	sympathy_and_support
1106968561652826112	@LMasvutu There was never any disaster preparedness neither was there any urgency for being proactive after the warnings of the disaster. We hope and pray that no more lives shall be lost and no more damage shall be caused. #CycloneIdai #Thistooshallpass	sympathy_and_support
1110216653000851461	Please share your prayers for 2.5 million people across #Mozambique, #Malawi and #Zimbabwe who have been affected by #CycloneIdai ὤFὤF. We’re on the ground working to reach children and families who need us most:	sympathy_and_support
1108387306220806144	I’m at one of my favorite place in the world! So much beauty in this place but yet other parts of Mozambique was devastated from this Cyclone. My thoughts and support for all those affected by it.	sympathy_and_support
1107688073108824064	We express our sincere condolonces to all those who lost their loved ones as a result of #CycloneIdai. Our thoughts and hearts are with the families and friends of the people affected. Hats of to all those working tirelessly to save lives, properties.	sympathy_and_support
1107795420489625600	RT @Peter52501942: Who can help at chimanimani high school am looking for Shalin Mugano please	sympathy_and_support
1106993732484780037	#CycloneIdai Zimbabwe #Chimanimani For all people of faith this is not a time for thoughts and prayers but its a time for action. Your faith should work to help rebuild ruined lives, restore devasted homes. Lets join hands and do something!	sympathy_and_support
1110932911660957696	I met Mozambique’s ἟2἟FForeign Minister José Condungua Pacheco in Maputo this afternoon. I offered my sincere condolences following the devastation brought by Cyclone Idai and I reiterated the UK’s ἞C἞7commitment to help those affected.	sympathy_and_support
1108218528551890944	Deeply shocked and saddened by the destructions caused by cyclone #Idai. Our thoughts and prayers are with all those affected by this tragic disaster. We stand by our partner #Mozambique.	sympathy_and_support
1107066199278579715	All those affected by #CycloneIdai I pray that your lives and livelihoods are protected. May you be safe from this magnificent force of nature. May you have the tools and help you need to continue your lives afterwards. My prayers go out for you.	sympathy_and_support
1110168943593996289	RT @soccerzimbabwe1: @ChelseaFC David Luiz @DavidLuiz_4 calls for prayers to nations affected by Cyclone Idai  #C	sympathy_and_support
1107297132128681984	#CycloneIdai this animal is very destructive! Lets continue supporting victims in Manicaland. One Zim one people!! @InfoMinZW @nickmangwana @BishowParajuli @nelsonchamisa @edmnangagwa @zenzele @zvobgoluckson1 @CountEvans @nelsonchamisa	sympathy_and_support
1107574283390324737	Thank you @ZrcsRed for joining hands with us. @nigelchanakira @Busisa74 @fortunechasi @DrNyarai @Enomark1979 @Itairusike @xolanee02 @chipo_mtasa @FBCHoldings @DStvZimbabwe @eshonge @lptigere @supportingPWA @KirstyCoventry #cycloneidai #CycloneIdaiZW We can be the aid we need!♥ὤ3	sympathy_and_support
1108285284800700418	@fayaz_king Together we can my $1 can make a difference #CycloneIdai our prayers are with the victims	sympathy_and_support
1106545443100676096	#CycloneIdai Safety Tips 4. Avoid crossing bridges or roads next to rivers during heavy rain, as flash flooding is a risk. If stuck on a flooded road, switch to the lowest possible gear and proceed slowly. Using your brakes suddenly may cause you to skid or aquaplane;	caution_and_advice
1110107548261253120	On March 12 @NASA reported online that Tropical #CycloneIdai is poised to move inland over East African countries that were already soaked by flooding rain from the same storm system earlier this month. The storm system dropped heavy rain on #Malawi	caution_and_advice
1106760050981380097	The rainfalls have been pouring the whole night. Its not yet clear though to conclude about the damage but floods are imminent in Chipinge especially low lying areas. Govt must be on alert since Chipinge has gone fo more than 30hrs with no electricity. #CycloneIdai @InfoMinZW	caution_and_advice
1111459226143125504	#Mozambique | The response to the disaster caused by heavy flooding and #CycloneIdai will be simply enormous in scale. This is how our emergency medical teams are helping:	caution_and_advice
1108084411629744129	Beware of fraudsters who are collecting aid for personal gain under the guise of helping those affected by Cyclone Idai. As YIDARECT we urge well-wishers to Ensure that Aid is channeled towards those affected through Reputable &amp; Accountable organisations. #CycloneIdai #YIDARECT	caution_and_advice
1106864716910088192	#CycloneIdai Safety Tips 9. Invest in sandbags to place against doorways and low-level vents during flooding. Move high-value items to the highest floor in your home or a shelf;	caution_and_advice
1109539570087952385	Zimbabwe Online News Cyclone Idai: UNICEF warns of ‘race against time’ to protect children, prevent spread of disease in flood-ravaged Mozambique	caution_and_advice
1106816525003079680	#CycloneIdai Safety Tips 3. Just 15cm of moving water can knock you off your feet, while 60cm deep can sweep a vehicle away. Generally, if the water is deeper than the bottom of your doors or the bottom third of your wheels, it is not advisable to drive through it;	caution_and_advice
1107957651466522624	#CycloneIDAI Weather has cleared and floodwaters have subsided in many areas leading to Chipinge and Chimanimani although dark clouds still hang above @HStvZim @tapiwazivira @johnmokwetsi @EversonMushava @wisdomdzungairi	caution_and_advice
1109060518118154240	There are also many immediate dangers to animals affected by #cycloneidai Standing in flood waters can lead to foot rot, digestive and respiratory diseases. @movetheworld is deploying to assist	caution_and_advice
1111683215520079872	There are now 139 confirmed cases of cholera in Mozambique after Cyclone Idai. Doctors in Beira say they are seeing 200 suspected cases per day. People are being forced to drink contaminated water because the citys water supply is damaged, increasing risk of illness.	caution_and_advice
1113471337270530048	Mozambique: Cyclone Idai &amp; Floods Flash Update No. 15, 01 April 2019  via @reliefweb	caution_and_advice
1107131149028155392	This is the appropriate time to declare a state of emergency and to return home to coordinate and oversee the rescue operations. That you knew of the cyclone approaching and still proceeded to travel on non-essential business reveals a lot about your priorities , Sir #CycloneIdai	caution_and_advice
1106927276141264898	#CycloneIdai, Dams are also at risk of breaching since they already have high water levels. Those staying downstream should be warned.	caution_and_advice
1107020882927591425	RT @debeer_anika: More heavy rain in #Zimbabwe from #CycloneIdai	caution_and_advice
1109390403353096199	#CycloneIdai has triggered a massive disaster in Southern Africa, affecting hundreds of thousands of people. As the number of victims grows, #Mozambique has declared a national emergency. @WFP is rushing food &amp; other assistance w/ support from donors like @eu_echo ἟2἟F἞A἟A	caution_and_advice
1110957061792247808	The risk of an emergency exacerbating within the Idai disaster looms large. We need very urgently the resources not to fail the people who have already faced untold suffering!	caution_and_advice
1106811855530610688	RT @BlessMuchie: #CycloneIdai Safety Tips 10/10 Turn off gas and electricity if flooding occurs. *Keep Safe*	caution_and_advice
1107653042235678720	#CycloneIDAI If you are driving stay clear of trees, electricity poles and water points. Leave the car and quickly find secure shelter as vehicles can be easily blown away by the gushing winds.	caution_and_advice
1107629800460570626	#CycloneIdai The Minister of Local Government Cde July Moyo has advised motorists,that some roads and bridges in Chimanimani are currently cordoned off to make way for engineers to work on the damaged roads in the shortest possible time.@HeraldZimbabwe @diamond1038FM @ZimpapersI	caution_and_advice
1113161514591096834	ὪBViolence against women and girls ὪBSexual abuse and exploitation These are worrying issues in any emergency or crisis, like #CycloneIdai in #Mozambique #Zimbabwe and #Malawi. With our partners, we are increasing all efforts to prevent it from happening.	caution_and_advice
1107309860322983936	RT @RangaMberi: Hectic. Moza Met Dept is forecasting even more heavy rains.	caution_and_advice
1106924490737569792	RT @kwirirayi: Be on the lookout for flooding /rising water levels and quickly move to safety. In case of emergency dial 112. #CycloneIdai	caution_and_advice
1110650579800547332	This sanitary kit and blanket will go a long way to improve my privacy and dignity. Imagine, I was using a plastic paper as a blanket at the emergency camp, Elizabeth Major, Phalombe. #GENETResponse #CycloneIdai #MalawiFloods2019	caution_and_advice
1107294149924016128	These young boys idea of fun in a #CycloneIdaiZW flooded river in Mutare rural expose them to serious risk of drowning. Perhaps not enough warnings have gone through even as the death toll from the #CycloneIdai continues to rise @KirstyCoventry #Chimanimani #Manicaland	caution_and_advice
1112632417049890816	@Khalsa_Aid lorries with #aid left @ 2am, we left @ 6am. Getting to Chikwawa #malawi where hundreds of thousands displaced due to #CycloneIdai #malawifloods2019 was not easy. We had to half pack the lorries so they do not get stuck; our 4x4 had trouble getting there. #sewa	displaced_people_and_evacuations
1113523322434850818	Almost 5,000 children in Mozambique were separated from their parents by Cyclone Idai, says the UN. No one knows exactly how many people are missing yet. Thousands of people are still in camps waiting for floodwaters to recede and communication to be restored.	displaced_people_and_evacuations
1108682295689531395	Do we know how many displaced?	displaced_people_and_evacuations
1106909090784133120	RT @kwirirayi: Was there a call for people to leave dangerous areas before #CycloneIdai before it happened?	displaced_people_and_evacuations
1108766162815516672	Displaced women, among them pregnant women said they had lost their ante-natal care records, iron supplements and ARVs as they had all been washed away by the floods. They are in need of sexual reproductive health services and supplies #CycloneIdai #SRHR	displaced_people_and_evacuations
1109752243551719424	The CPU wishes to inform the public that Manyera Dam Wall in Vumba has weakened and all those downstream are advised to evacuate and go to higher places. Please if you have relatives in this area pass on this message at once. In case of emergency dial 111 or 112 #cycloneidai	displaced_people_and_evacuations
1113286483891433474	Visiting accommodation centres in #Beira with Graca Machel, President of @FDC_Moz. #CycloneIdai has displaced near on 129k people from their homes; they are hosted in 161 transit centres. @UNICEF + partners are on the ground.	displaced_people_and_evacuations
1110459900700823553	An estimated 900,000 children in Mozambique have been orphaned, separated from their families, made homeless, or otherwise affected by Cyclone Idai, officials say. Thats half of the 1.8 million people impacted overall.	displaced_people_and_evacuations
1116038010338856961	We visited a camp in Bangula, Malawi, today. Thousands of displaced residents are there after severe flooding in the region last month. They have nowhere to go. Donations from SA were handed over to the Malawian government and will be distributed soon. #CycloneIdai	displaced_people_and_evacuations
1110628888382750720	#CycloneIdai has affected more than 1.85 million people in #Mozambique. 483,000 people have been displaced by the floods. Red Cross teams are working tirelessly. #EstamosJuntos ὏7 @PunainenRisti	displaced_people_and_evacuations
1108171898238590976	These aerial photos in Chimanimani, (Eastern Highlands of #Zimbabwe) show the growing humanitarian crisis unfolding within the area as catastrophic #flooding has forced individuals to seek refuge in any shelter available. #CycloneIdai #Idai @cnni @CNNweather @CNN	displaced_people_and_evacuations
1109818182259204096	#UPDATE The powerful CAT4 #CycloneTrevor is now gone leaving massive damage, but no reported injuries &amp; deaths - thanks to the timely #evacuations. Below, evacuees are at the Royal Australian Air Force #RAAF military air base &amp; being assisted to travel back home. #CycloneIdai	displaced_people_and_evacuations
1108722131645415424	Makeshift shelters for survivors of Cyclone Idai as hundreds of families in Chimanimani and Chipinge have been displaced..#letsreachout #cycloneIdai #Zimbabwe @nutriactionzim	displaced_people_and_evacuations
1117773290003546112	Hundreds Of Thousands In Mozambique, #Zimbabwe And Malawi Displaced	displaced_people_and_evacuations
1107374941450784768	@ZBCNewsonline A responsible government should have ordered evacuation of schools the moment dozens of deaths were reported in Mozambique and the cyclone was forecast to hit the Eastern Highlands.	displaced_people_and_evacuations
1107194548818710529	1/2 WARD 15. Chimanimani urban 1)Number of deaths in Ngangu high density area :26 2)Houses destroyed : 80 * 3) Bridges destroyed : one at pondo WARD 10 : Chikukwa 1)No of deaths : 5 2) Households/houses destroyed :10+ #CycloneIdai	infrastructure_and_utility_damage
1109343705138376704	South Africa state electricity company: Stage 2 rolling blackouts nationwide today 9am-11pm as mismanaged, scandal-hit firm struggles with low capacity made critical by loss of power from Mozambique dams due to Cyclone Idai. Polluting diesel now being burned for electricity.	infrastructure_and_utility_damage
1109427616874971137	Beginning to see shortages of food and clean water in #Beira as the city is cut off due to flooding/inaccessible roads. Petrol is also running out. pipelines that supply fuel to Malawi, Zimbabwe, Zambia, DRC from #Beira In #Mozambique have been damaged. Cycloneidai	infrastructure_and_utility_damage
1112675380954124288	Drinking water supply is up and running again in Beira #Mozambique following the failure of all electricity and communications when the devastating cyclone #Idai hit the city  @VEI_NL	infrastructure_and_utility_damage
1117809067672645634	RT @SolarAid: #climatechange is hitting those who did not cause it, the hardest. Floods washed away crops in #Malawi #CycloneIdai	infrastructure_and_utility_damage
1108291692787056640	Total devastation in Beira, and loss of lives, homes and crops in Zimbabwe and Malawi due #CycloneIdai. Coming at the end of the growing season and wiping out crops means the next year will be extremely tough.	infrastructure_and_utility_damage
1106635576218918912	#MozambiqueFloods2019 LATEST: #CycloneIdai took down electricity cables and trees fell. Roofs flew off and part of the Munhava municipal stadium collapsed. More than 500,000 in Sofala Province have no electricity. Communication is impacted. - @WorldVisions Claudio Jamal	infrastructure_and_utility_damage
1107602339186335747	#CycloneIdai Update: Local Government, Public Works and National Housing Minister Hon. July Moyo said that communication between rescue teams are being made difficult due to poor network and power outages caused by the destruction of electricity lines.	infrastructure_and_utility_damage
1110090467490914305	CHECK OUT latest aerial photos of #CycloneIdai damage in #Mozambique provided by our colleagues at @USEmbassyMaputo. Yesterday our @USAID DART completed aerial assessments of hard-hit Beira &amp; reported that shelter remains a priority need.	infrastructure_and_utility_damage
1107343100429697027	The damage to infrastructure in #Manicaland is massive. #Zimbabwe needs urgent local, regional and international help. Bridge on the road road connecting #Chimanimani &amp; #Mutare was swept away. #CycloneIdai	infrastructure_and_utility_damage
1107571901730304000	RT @BBCWorld: Cyclone Idai: Massive and horrifying damage in Mozambique	infrastructure_and_utility_damage
1110210162223169541	#UNICEF warehouse also suffered major damage during #cycloneIdai in Beira. But this wont stop ὊAour humanitarian assistance to bring urgent life-saving support to the affected population, including clean water &amp; medical care.	infrastructure_and_utility_damage
1110880345744916480	Comrades from @CitManifesto movements went to assess the devastating situation in Chimanimani after #CycloneIdai. We call on citizens to keep up the inspirational spirit of solidarity! And food aid distribution must remain neutral! Together we are stronger! Tiri Tose!	infrastructure_and_utility_damage
1106973997118488579	RT @UNICEF_Moz: Tropical #CycloneIdai causing severe damage in Mozambique’s Sofala region &gt;	infrastructure_and_utility_damage
1112040485365911557	A Concern worker has described scenes of complete desolation” following a visit by boat to villages and towns cut off by Cyclone Idai flood waters in one of the worst hit areas along the Malawi/Mozambique border.	infrastructure_and_utility_damage
1111622304746868736	With the flood waters subsiding, the impact of #CycloneIdai is now evident. This is part of the road to #Buzi district #Mozambique that was cut off and why agencies were unable to immediately access affected communities to provide life saving needs. @BBC_HaveYourSay @reliefweb	infrastructure_and_utility_damage
1111967216893874181	The climate crisis has overlapping impacts on humanity, e.g. in low-lying underdeveloped areas. Thinking of those in Mozambique, Zimbabwe &amp; Malawi where historic drought, followed by the devastating Cyclone Idai &amp; flooding created a humanitarian crisis.	infrastructure_and_utility_damage
1112708389342248961	110 Thousand people with disabilities affected by the impact of destructions from Cyclone Idai and subsequent flooding in Mozambique. Any response to be sustainable must address their need	infrastructure_and_utility_damage
1108775544483708936	#Mozambique #CycloneIdai struck Mozambique last week &amp; caused devastating damage. Responders should use the languages best understood by people in the area to communicate effectively. Checkout this great @TranslatorsWB map	infrastructure_and_utility_damage
1107503008798126080	A big thumps up for Zim on the spirit of oneness towards the #CycloneIdai victims, wish it was done regulary not because of q disaster but for building the nation. Where it will be used for building one province at a time. Surely Zim will be an epitome of Africa through this	infrastructure_and_utility_damage
1106958123573620736	#CycloneIdai #Idai The effects of cyclone #Idai. Infrastructure destroyed and areas affected inaccessible. @BBCAfrica @eNCA @Wamagaisa @metofficestorms	infrastructure_and_utility_damage
1109838422099804160	CYCLONE IDAI UPDATE Electricity The main line from Chipinge to Chimanimani has 200 poles washed away. Works in progress Mt Selinda to Chipinge, 6 poles collapsed and works are in progress. #CycloneIdai	infrastructure_and_utility_damage
1107659780301225989	90% of the Mozambique city of Beira has been destroyed - the people of Mozambique are now suffering from the impacts of climate change on top of an economic crisis from secret loans by London banks	infrastructure_and_utility_damage
1110255893084626944	After destruction, the terrible silence. School bells always ring at 7 each morning. But in areas of Mozambique devastated by Cyclone Idai, again this Monday morning they did not. Many schools are ruined, while others are being used to shelter storm refugees.	infrastructure_and_utility_damage
1108289989744447488	Video of St Charles Lwanga teachers and students narrating their ordeal from the time Cyclone Idai destroyed the school  #Zimbabwe #StCharlesLwanga #CycloneIdai #Chimanimani	infrastructure_and_utility_damage
1108456345425059842	Tinashe has been finally laid to rest today in Marange after a long struggle to recover his body. The body was in 1 of those areas which not accessible by road. RIP Brother, Friend. With u the world was not going 2 be the same. He was so much in love with the Environment. Thanks	injured_or_dead_people
1108793892932108288	DESPERATION: More than 1000 people are feared dead in Mozambique after Cyclone Idai ravaged the nation, leaving first responders in frantic search to reach survivors. Complete coverage on #WorldNewsTonight with @IanPannell reporting from the region.	injured_or_dead_people
1108083467198386179	Bikita update. 5 death, 98 homeless, 1500 houses destroyed as of today. Statistics from meeting held today at DAs complex. Some areas still unaccessible. #CycloneIdai	injured_or_dead_people
1107635271653384192	The MDC has issued a statement, expressing its condolences over the scores of people killed by natural hazards induced by Tropical #CycloneIdai. So far, 82 people have been confirmed dead from drowning and falling boulders caused by the cyclone.	injured_or_dead_people
