tweet_id	tweet_text	class_label
1033591493749948416	#Keralafloods | We are in a safe zone not by chance but for a reason. It is our duty to help people in Kerala,” an official said. @mohanreports writes	sympathy_and_support
1031760816993918976	Kerala needs our support..A little help from each of us can bring a huge support to all those who are in need .. #KeralaFloods #KeralaFloodRelief #KeralaReliefFund #Kerala @NASSCOMfdn @MyKartavya	sympathy_and_support
1030848546076024832	@BeingSalmanKhan @iamsrk @AjazkhanActor and all bollywood Star please help #Kerla people #KeralaFloods	sympathy_and_support
1031487230622281728	Even small contributions will do. A helping hand is better than a praying lips ὤF #KodaguFloods #SOSKodagu #KeralaFloods #SOSKerala #KarnatakaFloods #Paytm #KeralaSOS #Karanataka #Karnataka #Kerala #IndiaWithKerala #IndiaWithKodagu #Floods	sympathy_and_support
1034805849116401664	Thank you so much dear @RahulGandhi ji for visiting the relief camps in our flood affected Kerala. Have no words to express my gratitude for listening to peoples woes, and being so compassionate to them. Your visit has done good for us and lighted hope to many. We love you.	sympathy_and_support
1032623386244001793	In this post, I deal with a key complication following floods - snake bites. I talk about steps following a bite, identifying poisonous snakes and the numbers to contact specific to the Snake Emergency team for #KeralaFloods	caution_and_advice
1032133506380353536	Alert on Electrical Safety during Floods by the #HSE #ElectricalSafety Dept of #BPCL #KochiRefinery. #KeralaFloods #DoForKerala #StandWithKerala #RebuildKerala	caution_and_advice
1033979836568457216	Dont eat uncovered/stale food #KeralaFloods @ndmaindia	caution_and_advice
1031154531290238976	RT @fayedsouza: #Kerala UPDATE | Red alert withdrawn from all districts; Orange alert in 10 districts &amp; Yellow alert issued in 2 districts	caution_and_advice
1031178765563379712	RT @beingabiker: spread the word #KeralaFloods #KeralaSOS #Medicines	caution_and_advice
1031078451237859328	Appeal to #Ayyappa Devotees * Kindly postpone your trips till official announcement comes from Travancore Devaswom Board * Red Alert is ON * No Flights, Trains and Roads are damaged Swami Saranam! #TempleConnect #Kerala #KeralaFloods	caution_and_advice
1038735805743869953	#KeralaFloods #keralafloodsrelief #keralafloodreliefSJM #keralarelieffund After Floods Healthy Ways : Chlorinate Your Wells Before Using Water.	caution_and_advice
1030730078966013953	General procedure to get help in #KeralaFloods 0. Do not panic. 1. Get coordinates. Use WhatsApp location sharing or Google Maps to get it, or call 1077. 2. Call regional helpline numbers and inform them the coordinates. 3. Not working? Call @cmokerala at 0471-2333812, 233682.	caution_and_advice
1030846852986368001	#attentionKOCHI. UBER will come and Pick up relief material from you for Free! Open UBER app and select FOODRELIEF IT IS TOTALLY FREE Dont use Uber for One biscuit or a pack of water. Use brain #KeralaFloods @dulQuer @Forumreelz @resulp	caution_and_advice
1032239565250224129	RSS mouthpiece Kesari published an article today criticizing Modi govt for blocking International aid towards Kerala. Kesari withdrew the article few hours ago, probably under pressure	caution_and_advice
1031398683684884480	#Kerala #Flood 2018 #LIVE #Updates: Heavy #rain alert in some areas over 24 hours as focus shifts to restoration; 210 dead so far	caution_and_advice
1030954117865209856	IDAMALAYAR DAM -19-08-2018 Reporting time - 4.00 am Reservoir water level. -168.41m Full reservoir level (FRL) -169.00m Dam spill- 400cumecs #KeralaFloods	caution_and_advice
1033993691302703105	Certainly not good news! Happened twice this year. Rising #arctic temperatures mean heat waves become more persistent and dangerous and rains become #floods. #SaveEarth #SavePlant	caution_and_advice
1037225451247357952	Additional cess for flood-hit Kerala may get diluted at GST meeting	caution_and_advice
1031520345704943616	RT @TrollCinemaOff: Thats a sweet gesture by the flood affected people ὠD #RespectHeroes #KeralaFloods	caution_and_advice
1032292347097309184	Also in this list of images, identifying venomous snakes and managing snake bites. The incidence of snake bites tends to rise after floods. #KeralaFloods #KeralaFloodRelief	caution_and_advice
1030405813490184192	Use a clean cloth to harvest rain water and use till rescue team arrive with support. If you feel this is a good tip please do share and spread to wider community #KeralaFlood #KeralaFloods2018 #SurvivalTip	caution_and_advice
1037520215850938369	(3/3)In times of global warming, which leads to intense bursts of heavy rains, an entire #Amaravati could be inundated within hours, leading to massive destruction as witnessed in the recent cyclones in Kerala. #KeralaFloods #AndhraPradesh #India	caution_and_advice
1031821902631718912	Heard that junior doctors are needed in #KeralaFloodRelief as rehabilitation starts after the water recedes. I am here to help. Please dm me or just tweet so that it can be discussed. #Kerala	caution_and_advice
1030857271763292160	More Heavy Rains expected in #Kerala. Red Alert issued Today in 11 out of the 14 districts except Thiruvananthapuram, Kollam &amp; Kasaragod in the state.	caution_and_advice
1032882440522493953	#BREAKING : #KeralaFloods case: #SupremeCourt orders to maintain water level at 139.99 feet in #MullaperiyarDam till August 31. #WeForNews	caution_and_advice
1030843271428227073	Meteorological Department Issues Red Alert #meteorology #KeralaFloodRelief #Kerala #KeralaDonationChallenge #PMModiWithKeralam #IPS #MLA #floods Read in Detailsὄ7ὄ7ὄ7	caution_and_advice
1032488151124590592	RT @jmathewgeorge: The rising tide: Perhaps, 2018 flood is only a gentle warning  #ClimateChange #KeralaFloods	caution_and_advice
1031059089621536768	There was a warning issued 7 years ago for illegal mining in Kerala. Authorities were warned to stop construction and mining near river! Who was accountable for not following this warning. My guess is Narendra Modi as CM of Kerala in 2011. #KeralaFlood	caution_and_advice
1037159981508788224	Pamba river near chengannur #Thiruvalla before and after kerala floods  #KeralaFloods #Keralafloods2018	caution_and_advice
1032817225537712128	Lost everything from house to utensils: Lakhs affected by Kerala floods  #KeralaFloods #KeralaFloodRelief	displaced_people_and_evacuations
1038635290942943232	#KeralaFloods 27 families belonging to Christian community moved to another camp from their camp on Saturday as they did not like to share space and food prepared by the #Dalit community members.	displaced_people_and_evacuations
1039453637091549186	RT @ndtv: Over 4,000 displaced people still in 120 Kerala camps  #KeralaFloods #KeralaFloodRelief	displaced_people_and_evacuations
1035076941785620480	4000 families in 400 villages across #Nagaland have been evacuated in the wake of heavy rains, #floods and power cuts.	displaced_people_and_evacuations
1030396011120939008	My father, who lives alone in Thrissur, had to evacuate when the water in his home reached three feet. The tragedy is affecting almost every home. #KeralaFloods Heavy rain forecast for next few days.	displaced_people_and_evacuations
1031094550574583809	More than 5000 people from various parts of Kerala arrived in Shirdi. They have been given accommodation and food till situation back home improves. Special thanks to Shirdi trust. #keralafloods #KeralaFloodsHelpNeeded	displaced_people_and_evacuations
1031107151651983360	This place was home 4 me 4 last four days. Hw cn I leave t dirty ? We keep our home clean right?” Said one f te inmates. Tis s how te displaced people left behind one f te rooms where 1200 people stayed in Kongorpilly Govt Higher Secondary schoolὄF #PositiveStories #KeralaFloods	displaced_people_and_evacuations
1035442872286359552	#DamBreach in #Myanmar #floods 85 villages, displacing thousands  #flooding #dam #flood #flashflood #Disaster #Swar #Yedashe	displaced_people_and_evacuations
1030394717073108992	#KeralaFloods Please rescue my family of 6 including 2 elderly women stranded on the second floor of their house without food, water or electricity. The water is nearly reached the second floor. Opp Edanattidam Devi Shekthram, Arattupuzha, Chengannur. Mobile 9846747442	displaced_people_and_evacuations
1033355337556873216	My First SOS Call was to Evacuate a Pregnant Woman. Read the first-person account of a relief chopper pilot, as narrated to @GoyalMalini, in #ETMagazine tomorrow. #KeralaFloods #KeralaFloodRelief #ReadOnSunday #ETonSunday	displaced_people_and_evacuations
1033975292581298176	Following floods, 20 Kerala families forced to live in a cemetery  #keralafloods	displaced_people_and_evacuations
1033213755583213568	The buildings are largely empty now, their occupants either consumed by the rising tide or evacuated to safety.  #Keralafloods	displaced_people_and_evacuations
1030396033740636166	A pregnant lady with water bag leaking has been airlifted and evacuated to Sanjivani. Doctor was lowered to assess the lady. Operation successful #OpMadad #KeralaFloodRelief #KeralaFloods2018	displaced_people_and_evacuations
1032089854765498369	#KeralaFloods -- People displaced by the floods in Kerala are returning home to the frightening sight of venomous cobras and Russells vipers.	displaced_people_and_evacuations
1037236609907707905	Natural disaster or man-made tragedy of gigantic proportion caused by mishandling of water flow of dams; what is causing concern in Delhi is delay by Kerala Govt in submitting official data abt extent of damages caused in man-made floods	infrastructure_and_utility_damage
1033920975824289792	Separate applications are not required for the compensations for losses incurred in the flood, including compensations for damages to houses. Only those who have lost their documents have to submit applications online. #KeralaFloodRelief	infrastructure_and_utility_damage
1035750535893340160	Kerala Floods : More than 200 houses damaged in Flood in Munroe Island	infrastructure_and_utility_damage
1030396219351347200	Hospitals, Medical shops are all under water; Options to save people are very limited. Union Min @alphonstourism speaks to MIRROR NOW on #KeralaFloods	infrastructure_and_utility_damage
1035061135228194816	#keralafloods #ewastekerala #ewasterecycler Most of these damaged electronic gadgets contain harmful materials and toxic chemicals, and if not disposed	infrastructure_and_utility_damage
1033025520097787904	1. Floodwater has largely receded leaving behind a trail of destruction. It will take now years and lots of resources to rebuild and revive the society. @amitsurg @sssingh21 #KeralaFloods #KeralaFloodRelief Photo credit: @PEHL_India	infrastructure_and_utility_damage
1035439070925582336	Tata Project Ltd was entrusted with the task of reconstructing roads, buildings and bridges destroyed in the rain fury at Pamba, the foothills of famous Lord Ayyappa shrine in Sabarimala #KeralaFloods	infrastructure_and_utility_damage
1034488804088930312	@IncomeTaxIndia Why everyone selectively ignoring #KodaguFloods the devastation is more in #kodagu also as landscape itself transformed due to landslide, around 1800 homes vanished completely without any clue of their presence.We 2 mourn for #KeralaFloods but dont ignore #Kodagu @narendramodi	infrastructure_and_utility_damage
1035098462214213633	According to a preliminary estimate, the loss and damage due to the rain fury was Rs 20,000 crore, but Chief Minister Pinarayi Vijayan has said it would be much more #KeralaFloods #KeralaFloodsRelief	infrastructure_and_utility_damage
1032085360308715520	Early release of dam water could have reduced Kerala flood damages, say experts. The water levels had been rising in the dams since mid-July, according to data from the Kerala State Electricity Board.	infrastructure_and_utility_damage
1035145223536627713	Its literally low cost construction way to rehabilitate to all those house which get more damaged and lost by natural calamity, torrential, flood and high tide..Its a breakthrough .. must be applied to more affected area to revive the human life	infrastructure_and_utility_damage
1037366231232331776	Two disasters were happening at the same time. While floods in plains got relatively better attention, widespread landslides in high range areas didnt. Road, electricity could be restored only after a good 10-12 days. Many lives lost &amp; houses vanished. #Idukkki #KeralaFloods	infrastructure_and_utility_damage
1030389194131001344	Kerala Floods : Ernakulum Railway Station gets completely submerged under water  #KeralaSOS #KeralaFloodRelief #KeralaFloods2018 #KeralaFlood #Floods #floodrelief #Ernakulam #KochiAirport #KochiMetro #kochi	infrastructure_and_utility_damage
1030416266958266370	Intensity of rains have eased in Kerala so flooding will recede gradually but it will take long time to recover from all the damage from unprecedented rains in state. Help your fellow Indians anyway if you can.  #KeralaFloodRelief	infrastructure_and_utility_damage
1034477706442952705	1. #HAI team, along with its local partner Cosmic Community Centre, undertook an assessment visit in the Alleppey district today, and found extensive damage to the agriculture sector. #KeralaFloods #KeralaFloodRelief	infrastructure_and_utility_damage
1035235211460542464	After #Assam &amp; #Nagaland, its now #ArunachalPradesh. State after state battles devastating #floods. But Does India care?	infrastructure_and_utility_damage
1031093958091268097	#KeralaFloods: Road clearance work underway in Nelliyampathy hill station after multiple landslides damaged the roads	infrastructure_and_utility_damage
1032294314280275968	The solar power system of the worlds first solar powered airport has also suffered damage in the floods, they had said. #KeralaFloods	infrastructure_and_utility_damage
1036672534744248320	RT @josekammca: KERALA FLOOD DAMAGE TO DIVINE RETREAT CENTRE  via @YouTube	infrastructure_and_utility_damage
1032263428134457344	#KeralaFloods after effect - Fresh landslide in #Munnar, #Kerala. 2 building of Govt Arts College destroyed completely.	infrastructure_and_utility_damage
1030751727371177985	Heavy rains have been lashing the state since August 9, rendering lakhs homeless, destroying property worth millions. #KeralaFloods	infrastructure_and_utility_damage
1032555495851053056	#HealthOfKerala #Keralafloods Pamba River Back Waters in #Alleppy are still 4-5 Meters high than the normal level. Due to this houses are still submerged in water. People have been rescued and house boat business is shut @rama_rajeswari @D_Roopa_IPS @jiteshpillaai @Kerala_floods	infrastructure_and_utility_damage
1033176476915400704	Thank you @SanjayAzadSln MPfor your decision to spend 1 Cr under #MPLAD and adoption of a village in Ernakulam District which is badly affected by #KeralaFloods. @AamAadmiParty is always in a lead by setting examples. @CRneelakandan @ArvindKejriwal @AAP_Kerala @attorneybharti	infrastructure_and_utility_damage
1032276099126898688	Lulu Mall-Kochi which was closed due to the damage caused in the #KeralaFloods will reopen from Thursday. The malls lower and upper basements got completely flooded, thus severely damaging its’ electrical and pump rooms, crucial equipment and fire systems. @LuluGroup	infrastructure_and_utility_damage
1037221283099029506	blogging sites about the ulterior motives of the CPI-M leaders&amp;the Kerala ministers What is causing concern is the delay by the Kerala Govt in submitting to the Centre the official data about the extent of damages caused in the man-made floods #KeralaFloods	infrastructure_and_utility_damage
1033643856317706240	WATCH | A government school in Kerala has been turned into relief camp for the flood-affected people. Over 260 people have been killed in #KeralaFloods that is the worst in over a century. #IndiaForKerala #KeralaFloodRelief	injured_or_dead_people
1031517319741100032	Kerala Floods : Death toll rises 357, andὄ7#KeralaFloods My Presence in Kerala is Not Needed At the Moment: Shashi Tharoor -	injured_or_dead_people
1030745686118023169	The worst floods in a century in Kerala have killed 324 people and forced more than 200,000 into relief camps, still CPI’s forest and wildlife protection minister K Raju is in Germany to attend a conference which is taking precedence over Flood Relief. #KeralaFloods	injured_or_dead_people
1030918219865837568	RT @abpnewstv: #KeralaFloods death toll 357, 11 districts still on alert	injured_or_dead_people
1030394114133524481	#KeralaFloods - In 9 days since the rains started 164 deaths till now. 2.25 lakh people in relief camps. Situation alarming in #Pathanamthitta, #Ernakulam #Alappuzha &amp; #Thrissur the worst affected areas.	injured_or_dead_people
1036253682935848960	RT @TheWeekLive: With eight more deaths reported on Sunday, the total toll in last three days have risen to 26  #Ker	injured_or_dead_people
1030761699261870081	#KeralaFloodRelief #KeralHelp #KeralaFloodRescue #KeralaRescue #savekerala Over 100 killed in Kerala in just one day as flood crisis worsens: Top developments - Times of India  via @timesofindia	injured_or_dead_people
1030407748431663106	Death toll crosses 100 as #KeralaFloods continue to remain grim.  #KeralaFloods2018 #KeralaFloodRelief #KeralaFlood @Kerala_News	injured_or_dead_people
1031490254560059394	We are deeply sorrowed at the casualties caused by massive flooding in #Kerala, #India; over 350 people have died and thousands are trapped. #SAF extends prayers and condolences to the families of the affectees and stands in solidarity with them. #SAFCares #HopeNotOut	injured_or_dead_people
1031372630371102720	RT @TheQuint: #QBullet | Flood death toll rises as #Kerala faces long road to recovery. This, and other top news on QBullet. /	injured_or_dead_people
1036081664139489280	Kerala sounds alert for water-borne disease, 28 deaths reported	injured_or_dead_people
1030961388037005312	RT @globeandmail: More heavy rains likely in India’s Kerala as flood death toll jumps	injured_or_dead_people
1032477735552053248	5784 people died in Uttarakhand in 2013, UPA Govt handled d tragedy by their own n refused foreign aid. No one had any objection, not even Uttarakhand Govt or people.370 people died in Kerala flood and centre did the same and ecosystem turned psycho.	injured_or_dead_people
1030385680063459328	RT @tv9gujarati: #Kerala: Death toll due to floods has risen to 167: Kerala CM Pinarayi Vijayan #KeralaFloods	injured_or_dead_people
1030971883485716480	At least 324 people have been killed in flooding in the southern Indian state of Kerala! 200,000 people left homeless. #KeralaFloods #Kerala The state Needs Your Support and Help! Request everyone to contribute towards the relief activities and	injured_or_dead_people
1032117887769530368	@sanjivbhatt RSS-BMS worker and Kerala Electricity board employees dies during flood relief effort in Kerala.	injured_or_dead_people
1032219860284203008	Rain was not the only factor behind #KeralaFloods that killed around 400 people; poor development and abuse of the local environment also played a major part, say experts.	injured_or_dead_people
1032052791328436225	Kerala is reeling under floods , 400 + people died but local MP Mr Tharoor is in Geneva .. did GOI asked him to go to UN and beg ?	injured_or_dead_people
1032592007808446465	#August this year has been a killer month so far. Besides the #KeralaFloods that killed almost 400 people and left thousands homeless, it has taken the lives of: #Karunanidhi #SomnathChatterjee #GurudasKamat #VSNaipaul #rkdhawan #AtalBihariVajpayee #KuldeepNayyar	injured_or_dead_people
1030985351173681152	#KeralaFloods update: Death toll rises to 357, troops called for help	injured_or_dead_people
1032312585226477569	373 dead in #Kerala #floods. On avg, 1,200 die every yr in India in floods/rain, disrupting 32 mn lives, affecting area nearly twice the size of Kerala. By 2050, effects of #climatechange could lower living standards of half of Indians.	injured_or_dead_people
1030999007039037440	Death toll in Kerala increased to 300+ today, the lives of millions of people remain paralyzed. Incessant rains, overflowing rivers and landslides have left many severely injured and all 14 districts in Kerala, under water @RahulGandhi @Allavaru #KeralaFloods	injured_or_dead_people
1031072082958794752	RSS loses a Swayamsevak to the #KeralaFloods. P Reghunath died during the relief operation at Alappuzha, Kerala. #Naman	injured_or_dead_people
1032154489170604033	The death toll of #KeralaFloods is not 365. It is 20365 people. The government is refusing to count the under 20000 @RSSorg workers but counting only congis and CPI members in the list. If they are alive atleast some relief workers on ground would have seen them in real.	injured_or_dead_people
1031083075793432582	RSS Swayamsevak, BMS functionary Sri P Raghunath lost his life during rescue works at a Flood hit zone in Palakkad, Kerala. #Pranams	injured_or_dead_people
1032117013517197312	#KeralaFloods Flood affected victims in lot of areas are complaining that they were not given any proper alert, briefing on opening of shutters of other dams. They only knew about Idamalayar and Idukki dams and that through media.	not_humanitarian
1033025539580342272	RT @pavan_sethi: #EvmKillsDemocracy and Fenku kills humanity. @AamAadmiParty @JoinAAP	not_humanitarian
1033723676057894912	#Kerala should take loan from banks instead of asking peoples help. #KeralaFloods	not_humanitarian
1032293956963393536	Abbeh chal hatt. The floods have come because they didn’t let us have the beef and Sanghis exported all of it out of India.	not_humanitarian
1031722266449666049	#KeralaFloodRelief #KeralaFloods #KeralaDonationChallenge Blaming Women &amp; Beef for Kerala Floods?! You Must Be Kidding	not_humanitarian
1031043670739283968	Sanghi pearls of wisdom on what caused #KeralaFloods ὄ7 This is what Sanghi ideology does to you. Your mind gets clogged with irrationality, hate, insecurities, violent thoughts, you lose all logic &amp; direction #servehumanitysaysstramrahim #KeralaFloodRelief #ExpressFrontPage	not_humanitarian
1032231271630397440	@ensine Much to the disappointment of half dicks outraging on twitter, this photo is from 2016, possibly Iraq and NOT #KeralaFloods PS: Not all black tents are from Kerala .. ! ὠ2ὠ2ὠ2ὠ2	not_humanitarian
1032269429281714181	CPM is hiding its multiple failures !	not_humanitarian
1030408473023004672	@VORdotcom That is AK. Check with AAP and how they blew up money. If you cannot contribute to Kerala Flood Relief keep your trap shut and dont tweet gibberish	not_humanitarian
1032333702431432704	How could I even think of making him PM? In the amidst of Kerala flood where people cannot be located whether dead or alive, this man is touring Europe.	not_humanitarian
1032170711027073024	@AnilNPillai32 Saranam iyyappa ὤF Any court order, banning liquor sales, since d state is now depending on aids from all over the country/ world, but no shortage of money to buy liquor ὄ7 See d queue, after opening of a liquor shop, in flood affected Kerala.	not_humanitarian
1033045198077677569	So no offer of aid has been made for #KeralaFloods yet by #UAEVijayan has been lying. What @cpimspeak leaders will advise him? Keep lying? #justasking!	not_humanitarian
1033205367533125632	@TimesNow @DDNewsLive @indiatvnews After #UAE denial about the offer of flood relief to #Kerala , paranoid politicians should shut foul mouth. @Ra_THORe @rsprasad	not_humanitarian
1030999236429733888	@KirenRijiju @narendramodi Rahul why dont you spare some from the billions you are supposed to have kept abroad for the welfare of Kerala flood affected.	not_humanitarian
1032963780752228352	The UAE Ambassador Ahmed Albanna has categorically denied the announcement of Rs. 700 crore aid to India for #KeralaFloods But NYT continues to peddle fake need just like India ka apna Presstitute channel @ndtv	not_humanitarian
1032190805354532865	#KeralaFloods @INCIndia @ShashiTharoor getting in2 the frame with his @UN back ground like his LORD &amp; MASTER @RahulGandhi NON EXISTENT #NationalCalamity mirage. What was good for TN tsunami, UKhand, Kashmir, IS GOOD for #KeralaFloodRelief	not_humanitarian
1032258163909640192	RT @ghost22090440: Disgraced former cop Sanjiv Bhatt caught sharing fake image about Kerala floods	not_humanitarian
1036610614771232768	#Kerala is facing a drinking water crisis. Most villagers are dependent on wells for clean drinking water, which got contaminated during the floods. Our team is on ground to clean the wells, and provide water purification tablets to the most vulnerable people. #KeralaFloods	not_humanitarian
1032276141669724161	What Kerala CM Pinarayi Vijayan?It is the Armed Forces, which Ur party custards abuse day&amp;night along with RSS, Sikh volunteers &amp; ordinary ppl who toiled 24/7 &amp; deserves applause, not Ur Quisling party thugs &amp; supporters busy creating North-South divide:	not_humanitarian
1032542760501370881	Why we didnt accept aid from foreign countries before and now. #KeralaFloods #IndiaWillStandOnItsOwn #NaMo #MMS #ABV	not_humanitarian
1034817078304235522	@Kickass_monk @rajanandbjp @ProudHI31956314 How dare you compare Shitty RSS with The Great Indian Army? If RSS had actually did Flood Relief in Kerala, why they had to circulate fake photos? Isn’t it proves RSS as biggest Liars?	not_humanitarian
1034758219984515073	Why the Navi Mumbai airport could go the Kochi way ? The @CMOMaharashtra is building the #NaviMumbaiairport across the harbour by razing hills to the ground and raising the height of the runways by 5.5 metres, since these are on #floodplains. #Floods	not_humanitarian
