tweet_id	tweet_text	class_label
901692765003808768	This and tornado warnings left and right. That sums up my night. #getmeouttahere #HurricaneHarvery	caution_and_advice
901819792381927424	@RebeccaSpera #abc13 #houtraffic -- Stay with ABC13 for continuing coverage of the flooding associated with Hurricane Harvey.	caution_and_advice
903764769571831808	Tornado warnings, flash flood all over NC today. Remnants of #HurricaneHarvey Feeling blessed. #PrayForTexas	caution_and_advice
901775466402635776	RT @JohnBridges: San Marcos River approaching major flooding at Luling. #harvey	caution_and_advice
902901425306566656	TS #Harvey accelerates toward WV resulting in expanding flooding threat across Central/SE U.S. Storm dissipates into wave overhead Fri/Sat	caution_and_advice
901076998658949120	Evacuations begin as Hurricane #Harvey bears down on Texas  @KatyBlakeyNBC5 &amp; @KrisGutierrez are there for @NBCDFW	displaced_people_and_evacuations
903651229976457216	Pewaukee woman searches for animals displaced by Hurricane Harvey.	displaced_people_and_evacuations
901826733451747329	RT @HouseCracka: Failure of Leadership. No Evacuation Order for Houston from the Mayor. #HoustonFloods #Houston	displaced_people_and_evacuations
903437790817509376	Seattle-area takes in Texas shelter dogs displaced by Hurricane Harvey, flooding  ➜	displaced_people_and_evacuations
902603857674502144	First Hurricane Harvey refugees arrive at Joel Olsteens megachurch	displaced_people_and_evacuations
901775360781668353	Watch Now: First Look at #Harvey Destruction » Alex Jones Infowars: Theres a war on for your mind!	infrastructure_and_utility_damage
903389136408727552	Knocking out damaged walls in my neighborhood, what a work out!!! But a helpful and rewarding one at that @TexansCheer @HTC_Speaker #Harvey	infrastructure_and_utility_damage
902899995887751168	#Harvey damage adds urgency to #flood #insurance debate	infrastructure_and_utility_damage
903056877579329536	This is the damage around the #blueshed where Storm Chaser @Jeff_Piotrowski filmed as #Harvey made landfall. @NOAA_HurrHunter	infrastructure_and_utility_damage
903362874017550338	Explosions rock Houston-area chemical plant following Hurricane Harvey flooding	infrastructure_and_utility_damage
901134792984604673	Hope #HurricaneHarvey not as deadly as Galveston Hurricane of 1900. Killed 10-12 thousand. Greatest nat disaster in US hist.	injured_or_dead_people
903503720196972544	Death Toll From US Hurricane Harvey Climbs to at Least 47	injured_or_dead_people
903645223758254081	Clearly some feel the death toll in my city hasnt risen to a more preferable level, so these folks are willing to help. #DISGUSTING	injured_or_dead_people
902850866817970176	18 people have died due to Hurricane Harvey and @realDonaldTrump has said NOTHING. His silence is deafening.	injured_or_dead_people
902867876394225664	Beyond heartwrenching. Mom dies saving her baby girl during #Harvey flooding	injured_or_dead_people
902594140659220480	Sunshine will help us warm into the mid 80s today. @NC5_BreeSmith has the latest on #Harveys track later on @NC5	not_humanitarian
902712716720308225	I support Treasures decision to not open their doors. Its a place for titties NOT a shelter!	not_humanitarian
902731225776873473	Real life: Trump compares Hurricane Harvey to flooding in NYC property he managed: Water damage is the worst.	not_humanitarian
901195449150959617	Hurricane Harvey strengthens threatens record floods Texas . It takes a hurricane for @Potus to NOT b on TOP STORY!	not_humanitarian
903044815994179584	trump and Melanoma have no clue because they were nowhere near the affected areas.	not_humanitarian
902662908223643648	Heres our running series of #Harvey stories from ordinary Houstonians.	other_relevant_information
901115793609457664	UPDATE! The Dominion Tour of Homes is rescheduled to Sunday, Sept. 10th from 1-5pm due to Hurricane Harvey. RSVP:	other_relevant_information
902599740449312768	I liked a @YouTube video  Hurricane Harvey Flooding Houston | Khancept Episode 45	other_relevant_information
903652176387596289	At Meyerland, a flood-prone neighborhood in Southwest Houston. This is one of the luckier homes here. #Harvey2017 @statesman	other_relevant_information
902810588094464000	Water covering the road in front of Amelia Elementary on Major Drive in #Beaumont! #Harvey @12NewsNow	other_relevant_information
902647413776756737	Im Asking My NYC Friends To PLEASE Put Aside Gently Used Clothes 4 Hurricane Harvey Relief Efforts! More Details 2 Come! — feeling hopeful	requests_or_urgent_needs
902852944512634880	@Teeeeethegee water is now rising at our home. 4248 vassar st port arthur tx! we have a 4month old baby #HarveyRescue #harvey	requests_or_urgent_needs
902719631164547072	Hurricane Harvey pets are looking for nee homes!	requests_or_urgent_needs
903448944922857472	#Logo #Design #Offer I am #Professional #Logo #Designer.If you Need any Logo design.Please Contact me:	requests_or_urgent_needs
902917704922927104	Need help identifying #hazmat? Free Emergency Response Guidebook app shows several ways:  #Harvey	requests_or_urgent_needs
902598225298849796	Thanks to the crew of AA70 LAX-DFW. Offered many supplies for my trip to #Houston @AmericanAir #Harvey2017	rescue_volunteering_or_donation_effort
903382629298384897	Along w/15K water bottles headed to #Houston will be support letters from students in #RichtonPark. #harvey #hurricaneharvey @cbschicago	rescue_volunteering_or_donation_effort
903422991463272450	For those who want to help. Heres how you can. Im signed up, you can too! Houston will need your help for months to come. #HoustonFlood	rescue_volunteering_or_donation_effort
901767484176568320	If you can, please donate money or if you have the time drive over and help rescue animals and get them to a temporary shelter!!	rescue_volunteering_or_donation_effort
903056568987635712	We have young men throughout the city looking for ways to help with #Harvey. Please do not hesitate to ask. @ADomingSTH @STHCatholic	rescue_volunteering_or_donation_effort
903048522664210432	I liked a @YouTube video  #HurricaneHarvey #PrayForTexas | Flooding Simulator (Cities Skylines)	sympathy_and_support
901771138400956416	@WilliamShatner Non-stop rain in Sugar Land and tornado and flash flood warnings throughout the night but we are holding fast! Thank you for the prayers.	sympathy_and_support
901797075695886336	RT @Dxnii__: This Harvey shit aint no joke man. Hoping that everyone is safe and that their property isnt damaged. Help where you can	sympathy_and_support
902634399497207808	Not sure how to help with #HurricaneHarvey relief? @Funimation is donating $10k and matching up to $25k of your donations via this campaign.	sympathy_and_support
902647009353588736	As @thecovechurch, we have the chance 2 help the ppl of Texas! Go to  &amp; see how u can get involved. #HurricaneHarvey	sympathy_and_support
901671207552069632	RT @KinggCecee: Im too scared to sleep with all these tornado warnings! #HurricaneHarvey	caution_and_advice
903395835295260672	Do not eat any food that came in contact with #Harvey floodwaters. When in doubt, throw it out.	caution_and_advice
902634169699840001	An important warning, but lets be clear: major floods are not unprecedented, and that history helps us know the potential impacts.	caution_and_advice
901264316359487488	#HurricaneHarvey approaching Victoria, TX, 9:00pm - youll notice theres someone out driving in this at the end @CBSNews	caution_and_advice
903377549694078976	Live in an area affected by #HurricaneHarvey? Here’s how to make sure your food &amp; water are safe following a flood.	caution_and_advice
903767179694415876	Evacuations, flooding continues a week after #Harvey made landfall in #Texas - Sep 1 @ 7:50 PM ET	displaced_people_and_evacuations
902877945387249666	Wow. #AirBnB Free Listings in Houston and Austin for Hurricane Harvey #Evacuees	displaced_people_and_evacuations
902670234577985536	#Animals are not forgotten during #Harvey evacuation ! Thank you @austintexasgov ❤️ #OneWelfare #Emergencies	displaced_people_and_evacuations
901149455486824448	Hurricane Harvey Update, Voluntary Evacuation Issued, La Marque Shelter Established	displaced_people_and_evacuations
900928755966681088	Mandatory evacuation implemented in Victoria County before Hurricane Harvey hits  #KSATnews	displaced_people_and_evacuations
901421852475740161	First light in Rockport Texas. A lot of damage. #hurricaneharvey	infrastructure_and_utility_damage
903649093972582401	RT MyMusicGrind UGK’s Archives Reportedly Destroyed By Hurricane Harvey	infrastructure_and_utility_damage
902704673286709248	Thousands of homes still swamped three days after Hurricane Harvey hit:	infrastructure_and_utility_damage
903656835386888192	Harvey Damage Shuts Main Fuel Line From Texas to New York - NBC News	infrastructure_and_utility_damage
902835852740571136	@JWMarriott @JWMarriottATX @JWMarriott I cant believe ur @JWMarriottATX would treat a #HurricaneHarvey resident like this bc THEY have lost $! What about our homes!	infrastructure_and_utility_damage
902728293740367872	– The death toll continues to rise as massive amounts of rain from Hurricane H  #fakenews	injured_or_dead_people
903398478197530624	#HurricaneHarvey leaves 38 people dead, including a veteran police office, in the #Houston area. #TwitterNewsChat	injured_or_dead_people
901779773332082693	At least 2 dead as Harvey slams flooded Texas coast	injured_or_dead_people
903632946996883457	At least 44 human beings are confirmed dead from Harvey. Evidently that isnt enough for some people. @B_HQ @benshapiro @RaheemKassam	injured_or_dead_people
903367007164182528	At least 22 #confirmed #dead as #Harvey pivots toward #Louisiana - The Washington Post	injured_or_dead_people
901809748655443968	The latest Resilience Reporting Daily!  #hurricaneharvey #cybersecurity	not_humanitarian
902703841304600576	Do yall realize how man shelters and first responders dont take pets? They probably didnt have a choice.	not_humanitarian
902918737908699139	Do u have Food Insurance? FD is the best food insur there is. Are u ready for a man-made or natural disaster? #Harvey2017 #HarveyStrong	not_humanitarian
903683742807375872	socialism causes environmental damage &amp; all that is blamed on climate change in order to cover up for socialists and socialism	not_humanitarian
903421590599323648	.@VP is again asked about #Harvey aid being offset by cuts. He repeats: I would leave those decisions to members of Congress and POTUS.	not_humanitarian
903053033055150080	Harvey’s flooding is triggering chemical spills, which could cause other environmental disasters	other_relevant_information
902645260068814848	#ICYMI: My latest appearance on @CBSThisMorning discussing Harveys impact on gas prices.  #Harvey #HurricaneHarvey	other_relevant_information
901822504624369664	Live: HURRICANE HARVEY SLAMS TEXAS, TORNADO &amp; DEADLY FLOODING STORM VIDE  via @YouTube	other_relevant_information
903750645425082369	What Are The #Antifa Doing After #Harvey?  Mutual aid is antifascism.	other_relevant_information
903496499463520256	Houston flooding as seen from space. #Houston #Harvey #HoustonStrong #HoustonFloods @NASA #NASA #TexasStrong #TexasFloods #space	other_relevant_information
902646420855033856	Please help us raise money to benefit students and families affected by Hurricane Harvey. #LyleLove	requests_or_urgent_needs
903748163940601857	Have heard medical supplies are needed at the #Beaumont airport, colostomy bags, catheters, syringes, many in need.#HarveyNeeds #Harvey	requests_or_urgent_needs
903510206046388224	These are the faces of #HurricaneHarvey doggies that need love. If you can shelter or adopt contact @SeattleHumane w/@AlexRozierK5	requests_or_urgent_needs
903395335585878016	Since Hurricane Harvey hit, the need to find Houston shelter animals homes is now more urgent.	requests_or_urgent_needs
903413220622393345	A message from Vuong, who started SDAshirts ministryis in need of your help! Hurricane Harvey flooded many	requests_or_urgent_needs
902731771866783745	#HelpForHouston - #Beyoncé pledges $7 Million to aid her home town of HHouston - Rolling Stone	rescue_volunteering_or_donation_effort
903745718564913152	An update regarding our online store donation. #HurricaneHarvey	rescue_volunteering_or_donation_effort
902653635951300608	Ivanka, Im trying to decide between donating to the Red Cross to help Houston or buying the book your dad recommended. what should I do?	rescue_volunteering_or_donation_effort
902840511022714881	As #HurricaneHarvey bore down on Coastal Texas, residents turned to their neighbors for help via @Nextdoor	rescue_volunteering_or_donation_effort
902916094725419010	.@UABCancerCenter reaches out to those affected by #HurricaneHarvey in need of cancer care.Please RT. #HoustonStrong	rescue_volunteering_or_donation_effort
902646585322024960	Joel Osteen: Prayers to all the people in Hurricane Harvey. Can we use ya church for cover? Joel Osteen:	sympathy_and_support
902845300842389504	Our @BGEA Rapid Response Team chaplains are ministering &amp; praying w/ #HurricaneHarvey victims in Victoria, TX. Continue to pray for #Texas.	sympathy_and_support
902851890404306944	Our heartfelt thoughts &amp; prayers are with the people affected by #HurricaneHarvey. To help visit:  #ReadyNJ #NJSP ♥️	sympathy_and_support
903743426293837825	Our prayers go out to those affected by #HurricaneHarvey. 🙏❤️If you or a member you know has been impacted, call: 1.844.760.2123 #yleo	sympathy_and_support
902653044369842177	@africanhunnybee w/@ywworg &amp; @JRobinsonDMS are safe &amp; thankful to everyone who reached out to make sure were ok #PrayforTexas #HarveyFlood	sympathy_and_support
901771566513504256	As Harvey downgraded to Category 1, concerns move to widespread flooding	caution_and_advice
901831452140109827	RT @TxDOTPharr: Dangerous flooding conditions for parts of #TX into next week. Heed warnings from local officials &amp; use caution on roads #H	caution_and_advice
902633516344778757	#Harvey is Houstons third catastrophic flooding event in three years. There are things we can do before the next:	caution_and_advice
901107280665509888	Hurricane Harvey continues to churn off the Texas Coast. Winds remain at 110 mph. Catastrophic flooding expected across S Texas #tristatewx	caution_and_advice
901437717778706434	The sun is rising over #Harvey this morning as a Cat 1 #hurricane with 80mph winds. VERY dangerous storm w/ flooding just beginning. #TXwx	caution_and_advice
901900503147261952	Tropical Storm Harvey swamps Houston with 2 feet of rain  #USNews #USRC	caution_and_advice
903392902495199233	For those affected by #Harvey go to , use @FEMA mobile apps, or call 1-800-621-FEMA to begin the process. #hounews	caution_and_advice
902673905256628225	Remnants from #Harvey will bring heavy rain to central Kentucky and southern Indiana later this week. Flooding may be possible.	caution_and_advice
902593870759960576	If your water is not safe, bring drinking water to a rolling boil for 1 minute to kill water-borne diseases.  #Harvey	caution_and_advice
901750196513767424	RT @SheriffEd_HCSO: @HCSOTexas reporting that a Tornado may have touched down on 45 South/Fuqua. Southbound from League City area. Estimate	caution_and_advice
903631135774793728	#ClimateChangeIsReal Its not just #HurricaneHarvey: August marked by deadly floods around world 🌎 - @CNN	caution_and_advice
901731259155611649	RT @WxJoeZamp: Comms. nightmare for Houston meteorologists tonight. Flash Flooding= move to high ground. Tornado= get down. Occuring simult	caution_and_advice
901459927809568773	Hurricane Harvey Hammers South as Tornadoes, Floods, Fires Rage	caution_and_advice
902638682334744576	#IRS warns about #scam of groups impersonating charities.  #charityscam #Harvey	caution_and_advice
901730036411191296	⚠️‼️ Tornado Warning for Fort Bend and Waller Counties in TX until 2:30 AM CDT	caution_and_advice
903662989181677569	Hurricane Harvey Has Displaced Hundreds of Pets	displaced_people_and_evacuations
902686248757862403	Lessons from Hurricane Harvey  #SHELTERINPLACE #ALERT Whether evacuation was ordered or just recommended, many resi	displaced_people_and_evacuations
902654665627766796	Pets from flooded Texas looking for foster homes in New Jersey  via @AsburyParkPress #harvey	displaced_people_and_evacuations
901476605935091713	Some #emergency contacts #Hurricane #Harvey #HurricaneHarvey #TX #Evacuations #assistance | Go to  for #shelter info	displaced_people_and_evacuations
902675983022649344	You can evacuate before storm or after floods &amp; mayhem, Houston chose late! #TrumpBackToSchoolTips #HurricaneHarvey #POTUS #FLOTUS #Harvey	displaced_people_and_evacuations
902905639067717632	Evacuating Houston before #Harvey didnt have to be all or nothing. Why wasnt a limited evacuation ordered? @FDRLST	displaced_people_and_evacuations
901826872862003200	@NOS Texas Gov Abbott (R) urged evacuation Houston, but #Houston Mayor Turner (D) said: Hold on a minute  #houstonflood	displaced_people_and_evacuations
901471948093313024	UNT enrolling students displaced by Hurricane Harvey -	displaced_people_and_evacuations
903682454610989062	Addicks Reservoir will be released for the next 10-15 days. More #evacuations are being announced. #Houston #Harvey #HoustonFlooding	displaced_people_and_evacuations
901146957078339585	BREAKING: Mandatory evacuations ordered  - #ClipTrends #VideoTrends #News_Po #Hurricane_Harvey #New_Jersey #NJ	displaced_people_and_evacuations
902612165839998976	JUST IN: Parts of Orange Co. under voluntary evacuation notice. #Harvey2017	displaced_people_and_evacuations
900899381506965505	A Voluntary Evacuation has been issued for my town. Now Im obsessively checking for updates on 1. BTS Her 2. Hurricane Harvey 3. My Sanity	displaced_people_and_evacuations
903617899306381312	From the horror of #Harvey to hope. 60 more evacuees from Beaumont boarding @GeorgiaGuard C-130 heading to safety in Dallas. @wsbtv	displaced_people_and_evacuations
902736547845472256	Residents who need shelter this evening are asked to go to @NRGParkFan (1 NRG Park, 77054) #harvey #houstonstrong	displaced_people_and_evacuations
902613894375641089	Hurricane Harvey: Joel Osteens church opens doors to evacuees after criticism	displaced_people_and_evacuations
902653763047100439	Trumps visits disaster-struck Texas amid Harvey #HoustonStrong #MAGA 🇺🇸#Harvey2017 🚣 🚣🏽 🚣🏼 🚣🏾	infrastructure_and_utility_damage
902629219770949632	#EmergencyCommunications bright spot: Even as #Harvey reached peak damage, crucial cell networks remained stable &gt;&gt;	infrastructure_and_utility_damage
902660012387909633	Cardinals WR Brittan Goldens Texas home dangerously close to flooding  via #12News #birdgang #Harvey #football	infrastructure_and_utility_damage
903751382498512896	LIVE: Chemical plant is on fire after an explosion at a Houston-area facility damaged by Hurricane Harvey -	infrastructure_and_utility_damage
903672439380508672	Everyones talking about floods, but lets not forget extreme wind damage in #Rockport #Texas, where #Hurricane #HARVEY 1st hit. Cool piece!	infrastructure_and_utility_damage
903478742013448194	With intense damage from #HurricaneHarvey affecting #Texas, it looks like another #hurricane Irma could make landfall next week sometime.	infrastructure_and_utility_damage
903747372781453312	JUST IN: Another large explosion and fire at flooded chemical plant in Crosby, Texas. #Harvey	infrastructure_and_utility_damage
901890793270587392	Photos: Hurricane Harveys destruction -  #HurricaneHarvey #Harvey	infrastructure_and_utility_damage
902894243622072320	Why did Houston tell residents to shelter in place? The alternative would have been a disaster. My story:	infrastructure_and_utility_damage
902857181866975232	Video shows the Chevron Phillips plant in Baytown, Texas underwater in the midst of historic #Harvey flooding.	infrastructure_and_utility_damage
902858441705836545	.@EWErickson accuses media of hypocrisy in handling of @realDonaldTrump visit to #Harvey damage.	infrastructure_and_utility_damage
903719652802494464	Hurricane Harvey hits the Deep South with flooded creeks, tornado-damaged homes and toppled trees.	infrastructure_and_utility_damage
902918211032686592	Holding our own here. Streets/homes still flooding, lots of closures, internet access sketchy AF. #CajunNavy still patrolling. #harvey	infrastructure_and_utility_damage
902901189108527106	#HURRICANEHARVEY Nations largest refinery shuts down as Harvey floods Texas; gas  YOUR GULF COAST WEATHER AUTHORITY	infrastructure_and_utility_damage
902654366573674496	Trump surveying #HurricaneHarvey damage in Texas: We love you, you are special what a turnout	infrastructure_and_utility_damage
901812435060973570	Two Dead and Dozens Hurt by Hurricane Harvey Slamming Into Texas Destroying Thousands Homes	injured_or_dead_people
902913126659645440	News Alert from @AP: Sheriffs office confirms two more #Harvey-related deaths north of Houston, bringing death toll to 20.	injured_or_dead_people
902725225342750720	#RIP to the retired teacher from Clear Creek high school. Death Toll at 6. #Harvey #OneIsTooMuch #HoustonStrong	injured_or_dead_people
902688763289059328	Death Toll Rises from Harvey | The Weather Channel	injured_or_dead_people
902625220153950208	This professor forgets hurricane Andrew in 1992, destroyed part of Florida , caused 65 deaths!!	injured_or_dead_people
902649149375614984	Steve Perez died trying to save victims of #HurricaneHarvey. Meanwhile, @realDonaldTrump arrived with this message:	injured_or_dead_people
902914388226650112	The death toll from #Harvey has risen to at least 20. #News4 #KMOV	injured_or_dead_people
902316645917507584	Texas officials say at least eight dead as Hurricane Harvey flooding continues  #alaska	injured_or_dead_people
902693906671947777	Journalism fail. People are dead or dying or stranded and someone thought it would be a good idea to run with this. #FFS	injured_or_dead_people
901805481408307208	RT @nbcwashington: Officials said Harvey is the worst Texas storm since 1961. Carla spawned 18 tornadoes and killed 46 people.	injured_or_dead_people
902843024799137794	The death toll has risen to 18 due to raging floodwaters caused from #Harvey. Details at 6	injured_or_dead_people
902898740247351297	#Harvey: Violent floodwaters engulfed a van and six people are presumed dead, including four siblings aged six to 16	injured_or_dead_people
902795888250249216	With 6 deaths in a population of 7 million, hurricane Harvey probably saved lives over the weekend because of the lack of regular traffic a	injured_or_dead_people
903593443057954816	The death toll for Hurricane Harvey-related deaths is now at 39.	injured_or_dead_people
901679436713615360	Hurricane Harvey: 1 dead, multiple reported injuries	injured_or_dead_people
902648073557614593	Since Thursday #wafflehouse has been the only hot food @televisionmaker and I can find. So thankful. #Harvey2017	not_humanitarian
902639392384323584	What are the political ramifications of paying for #Harvey damage and recovery? @RonicaCleary has the story in 5 mins. on #FOX5DC.	not_humanitarian
903429872823009280	A dear friend brought me Chinese food tonight. This was my fortune. #TexasStrong #Harvey #houston	not_humanitarian
902691142894059520	As night is coming and flooding is severe, a look at good news. As @IlonaOnTV pointed out: the sun is shining. Setting, but shining. #Harvey	not_humanitarian
903610326586884097	#Harvey will be Trumps first domestic emergency. Fun Reminder: his Administration lost track of a US aircraft carrier for over a week.	not_humanitarian
902909327987662849	Theyre singing in the shelters of Houston this is America. #Harvey	not_humanitarian
902646502551687174	They actually love floods,” says one researcher. It’s how they get around.”	not_humanitarian
902600812878327809	Im starting to get a physical reaction to Trump similar to food poisoningbarf!!	not_humanitarian
902917975010926592	@IowaFloodCenter Director Witold Krajewski relates Hurricane Harvey flooding to 08 floods.	not_humanitarian
902852873805025280	SICK! Nasty Liberals are CELEBRATING Trump Voters Being Victims of Hurricane Harvey!  via @truthfeednews#maga #trump	not_humanitarian
902653824413904900	When tragedy strikes, scammers rush in. And #HurricaneHarvey is no different	not_humanitarian
901805465008517121	Trump sees the world, including the country he now has a duty to keep safe, as nothing more than a reality show. Its truly sickening.	not_humanitarian
902711404922359808	If you dont think a house of worship should be a shelter to those in need, then we are definitely not reading the same Bible.	not_humanitarian
902745817290686464	@GovChristie liberals maybe wrong on some issues but they are about helping people they wouldnt deny aid like evangelicals @VP @SenTedCruz	not_humanitarian
903398707051233280	Stop those #otezla commercials showing people having fun in water until after #Harvey2017 is over. Emphatize dammit.	not_humanitarian
902719949088505856	@CheryleJ0806 @cat_justrsistin @maggieNYT @HouseGOP @SenateGOP I have a feeling, and I may be wrong, that #HurricaneHarvey has killed the wall.	other_relevant_information
903463000442621952	3 Ways the Fight Over #HurricaneHarvey Aid Could Get Ugly  #politics #getwoke #Republicans #Congress #TedCruz	other_relevant_information
902627312373522433	FEMA likely won’t be able to keep giving out aid $ for Hurricane Harvey unless Congress acts soon	other_relevant_information
902651369953398794	Rockport, Texas donut shop opens after direct hit from #HurricaneHarvey. Store owner to @CNNValencia: I’m not a hero, I’m working.”	other_relevant_information
902657946190057479	@CNNSitRoom Hurricane Harvey Shelters Closed or at-capacity shelter Open shelter	other_relevant_information
