tweet_id	tweet_text	class_label
901717967636975616	Storm chasing music  NWStornado Tornado Warning including Wharton TX, East Bernard TX, Wal	caution_and_advice
902854507851284481	228 tornado warnings associated with #Harvey thru 1020p EDT 8/29.	caution_and_advice
903364354824908801	Get important #flooding information about #HurricaneHarvey in this map  #Texas @ReadyHarris	caution_and_advice
902607303139930112	#HHS declares public health emergency in LA, TX. Health crisis stays after storm passes  (Photo CNN) #HurricaneHarvey	caution_and_advice
902655176376553472	Cancer patients impacted by Hurricane Harvey face unique and urgent issues. Here is helpful information and guidance from @AmericanCancer.	caution_and_advice
902618335094956038	Found this picture from #Harvey. If you arent prepared to carry your pet on your shoulders during an evacuation, dont adopt one. #shero	displaced_people_and_evacuations
902617217304539136	Speaking as a recent guest of the Cajun Navys #harvey evacuation. Yeahno. They will shoot back.	displaced_people_and_evacuations
902728946151813120	Right now @cbs11doug reporting live from one of the evacuation zones in #Houston. @CBSDFW at 10. #Harvey	displaced_people_and_evacuations
902630910499151874	Following criticism, celebrity pastor Joel Osteen opens his megachurch to those displaced by Harvey.	displaced_people_and_evacuations
902656496491569152	Joel, stop asking for money &amp; open up your 16,800 seater church for displaced victims you fucking fraud. Consider your prayers answered.	displaced_people_and_evacuations
903753660471136257	#HurricaneHarvey aerial photo damage assessment flights by @txwgcap, La. Wing continue over SE TX, SW LA.	infrastructure_and_utility_damage
902696669745225732	Hurricane Harvey may leave homeowners with $30 billion in damage. And most of it isnt covered by insurance.	infrastructure_and_utility_damage
902667139169038336	ABC NEWS: Drone footage shows scale of flooding near Texas Brazos River; set to crest at 800 year high! #Harvey	infrastructure_and_utility_damage
903429794427109376	Houston Hurricane Harvey damage Watch Now 👉	infrastructure_and_utility_damage
902611377105362944	#HurricaneHarvey Damage Piling up for SE Texas Dealers. #hurricaneharvey2017 #HoustonFloods	infrastructure_and_utility_damage
903660112199299072	#HurricaneHarvey | Texas preparation/response in perspective. 1,200+ dead in India, Nepal &amp; Bangladesh from monsoons	injured_or_dead_people
902851542730104834	RIP Sgt Steve Perez of @houstonpolice who was killed LOD while responding to #HurricaneHarvey plz RT &amp; show support #BackTheBlue 💙🙏🏼😞	injured_or_dead_people
902852228352008192	Wife reveals last words of Houston cop, 60, who drowned in his patrol car in Hurricane Harvey floods	injured_or_dead_people
902716619625029637	Authorities and family members have reported nine deaths from #Harvey.	injured_or_dead_people
902743498457202689	Hurricane Harvey path LIVE UPDATES: Tropical Storm death toll rises to 11 in flash floods	injured_or_dead_people
902645286799015936	#HurricaneHarvey: Another #LinkSwarm Roundup  @BattleSwarmBlog #HoustonFlooding #Hurricane #HurricaneSeason2017	not_humanitarian
902805084521857025	@abc13houston 3rd major flood in 15 months..0 floods in 60 years in Meyerlandsomething is wrong..I have a theory, but will reserve judgement #harvey	not_humanitarian
902646766918660097	The latest BrainFood!  Thanks to @cothrel @TheEliselise #hurricaneharvey #harvey	not_humanitarian
901805465008517121	Trump sees the world, including the country he now has a duty to keep safe, as nothing more than a reality show. Its truly sickening.	not_humanitarian
903695781248417792	Fuckin Obama destroyed the military - we dont have war fightin monster trucks anymore. Don has to rebuild that too.	not_humanitarian
902637561536851969	Update on JJ Watts fundraising effort for #HurricaneHarvey victims: $3,287,693 raised. New goal: $4 million.  #nfl	other_relevant_information
903369734166601728	I liked a @YouTube video  Hurricane Harvey Houston flood: Vibrio bacteria and snakes maybe in the water -	other_relevant_information
903411003081326595	Familys home was destroyed, but not their faith. In fact, it was strengthened by item left untouched by hurricane.	other_relevant_information
903382906751655936	@KelemenCari Viral Video: Woman inspiring Gospel Song In Hurricane Harvey Shelter is NAZI Charlie Hebdo THE MOTHER OF ALL NAZI	other_relevant_information
902719949088505856	@CheryleJ0806 @cat_justrsistin @maggieNYT @HouseGOP @SenateGOP I have a feeling, and I may be wrong, that #HurricaneHarvey has killed the wall.	other_relevant_information
903447424370343937	🆘ALL SOS REQUESTS NEED NAMES - ADDRESS - PHONE - HOW MANY PEOPLE? CONDITION #Houston #SOS #Harvey #REQUESTS PLEASE PROVIDE OR REQUEST‼️🆘	requests_or_urgent_needs
903053913305354240	#Harvey #Houston ET @PearlandISD: Pearland HS serving hot food for dinner to anyone in community til food runs out	requests_or_urgent_needs
902697370458234882	CInco, please help communicate this message to your followers: Seven Lakes HS is NOT a shelter, repeat NOT a shelter. Thanks.	requests_or_urgent_needs
903650709601648641	The women of Texas seeking abortion care have always needed our help, but now they need it more than ever. #Harvey	requests_or_urgent_needs
903431420487639040	Please share this and help those in need #HurricaneHarvey	requests_or_urgent_needs
902634430895980544	Cajun Navy is being shot at by looters as they risk their lives to rescue ppl from this catastrophic flood. #Harvey	rescue_volunteering_or_donation_effort
902614691310133249	Houston Police Department officer killed while trying to rescue victims of Hurricane Harvey.	rescue_volunteering_or_donation_effort
903422991463272450	For those who want to help. Heres how you can. Im signed up, you can too! Houston will need your help for months to come. #HoustonFlood	rescue_volunteering_or_donation_effort
903047778489827328	#Harvey - #Assistance - for those in hardest hit Texas counties	rescue_volunteering_or_donation_effort
902666537185689600	Stranded pets rescued amid Hurricane Harvey flooding in southeast Texas ❤️🐶	rescue_volunteering_or_donation_effort
903744346498916352	#Pray for families feeling the effects of #HurricaneHarvey. Pray for our team as we help the many in need.	sympathy_and_support
903360320617381888	Thank you Mexico for doing what the Agent Orange will NEVER do! Can you help us #ImpeachTrumpNow . 😂 #TheResistance 💜	sympathy_and_support
902649896863391744	Im far away physically but close at heart and in spirit with all my friends in #Houston and other areas affected by #HarveyFlood #Harvey	sympathy_and_support
902895168877076480	I am literally in tears!!! Lord please help!!!! Please 💔💔😪😪😭😭😭	sympathy_and_support
902637161392025600	Hang in there, Texans. We are with you. You are strong citizens who will get through this natural disaster together. #Harvey #PrayForTexas	sympathy_and_support
903402635130281988	When in doubt throw, it out. Keep your family safe from foodborne illness. Discard any items that may have touched #flood water. #Harvey	caution_and_advice
901097222200328194	#UPDATE: Hurricane #Harvey now 115 miles off #CorpusChristi; Catastrophic flooding expected via National Hurricane Center #LiveDesk #txwx	caution_and_advice
902603221956362241	STAY OFF THE ROADS. THERE IS NO WHERE TO GO. You are putting yourself &amp; first responders at risk. #HoustonFloods #Harvey @Fox26Houston	caution_and_advice
901680012281176064	RT @anniseramirezz: tornado touched down in cypress. please stay safe everybody fr man	caution_and_advice
903642551068057600	My friend Meechie has some awesome tips for #HurricaneHarvey survivors who will have to deal with property damage.	caution_and_advice
903052300394082305	#RGV shelters are welcoming evacuees impacted by Hurricane Harvey.	displaced_people_and_evacuations
901826872862003200	@NOS Texas Gov Abbott (R) urged evacuation Houston, but #Houston Mayor Turner (D) said: Hold on a minute  #houstonflood	displaced_people_and_evacuations
902512409243512833	Hurricane Harvey: Inside Houston shelter, a loud and sometimes chaotic night  via @TOIWorld #HurricaneHarvery	displaced_people_and_evacuations
902903241603780609	Anyone ready for a new pet? Lawrence Humane Society opening doors to Texas shelter animals displaced by #Harvey	displaced_people_and_evacuations
902700294420738048	#Houston #Harvey #KHOU Houston News Station KHOU 11 Evacuates On Live TV As Harvey Floods Studio  via @YahooNews	displaced_people_and_evacuations
902063211708530689	Former Valley resident describes Tropical Storm Harvey damage:	infrastructure_and_utility_damage
903458469189124096	30,000 to 40,000 (THOUSAND!) homes destroyed.	infrastructure_and_utility_damage
903389136408727552	Knocking out damaged walls in my neighborhood, what a work out!!! But a helpful and rewarding one at that @TexansCheer @HTC_Speaker #Harvey	infrastructure_and_utility_damage
902862126032805888	NWS Corpus Christi WCM John Metz &amp; I conducted first storm survey today of Aransas &amp; San Patricio Counties - unbelievable damage #Harvey	infrastructure_and_utility_damage
902613420326871040	Lindner: roughly 2500 homes impacted/ damaged from Addicks flooding. Nearly 700 at Barker. #HurricaneHarvey #HoustonFloods	infrastructure_and_utility_damage
902851580420014080	#News #Harvey makes landfall again, #Texas death toll mounts from record floods #HurricaneHarvey #flood #Deathtoll	injured_or_dead_people
902854736847757313	Historic flooding, rising death toll, homes decimated and some wanker decides its a good time to induce racial hostilities.	injured_or_dead_people
903671187842183170	@ggreenwald Like only white people were killed by Hurricane Harvey, what they said will only empower the right tbh	injured_or_dead_people
903577153056407552	The confirmed death toll from #Harvey now stands at 38 after Harris County confirmed the deaths of 6 more people:	injured_or_dead_people
902740400527507456	Death toll from Harvey now at 30  #HelpforHouston #HurricaneHarvey #HelpforHarvey	injured_or_dead_people
902859272425484288	Now local #Houston businesses near #LakewoodChurch are talking to press about how they lied! Yikes!  #HurricaneHarvey	not_humanitarian
902649244187799552	Paul Ryan opposed the Hurricane Sandy relief bill and voted no. We expect him to do the same for Texas.	not_humanitarian
903745233761992705	@realDonaldTrump @realDonaldTrump Will you be encouraging people to pray to the same god that brought them #HurricaneHarvey ?	not_humanitarian
903669921191796736	Incredible to see some areas near the KY/TN border seeing over 10” of rainfall last 24 hours from remnants of #Harvey #TNwx #KYwx #AGwx	not_humanitarian
903051208327397377	You try to loot ANY stores Or Homes in #Texas during #Harvey you get yo ass shot! #Houston #Beaumont God bless this man!	not_humanitarian
903496499463520256	Houston flooding as seen from space. #Houston #Harvey #HoustonStrong #HoustonFloods @NASA #NASA #TexasStrong #TexasFloods #space	other_relevant_information
902913336546738176	Hurricane Harvey: What Employers Need to Know, and How HR Can Help  #HR #Advice #Talent	other_relevant_information
902838686768918528	A Love Letter to My Sprawling, Scrappy Hometown of Houston #HurricaneHarvey	other_relevant_information
902841209990901761	People are charging $99 for a gallon of water during Hurricane Harvey recovery efforts	other_relevant_information
902840330382389248	Its not just #Houston! The population of the 53 counties affected is equivalent to the pop of 11 US states w/the smallest pop +DC. #Harvey	other_relevant_information
902654207194431489	Beyonce to help as many Hurricane Harvey victims as she can - ABC News	requests_or_urgent_needs
901826824363237376	#houston #harvey please #retweet all in help! so many people effected! sea #houstonflood	requests_or_urgent_needs
902598165429354501	Hey, Spring Cypress! Were now open and serving with a limited menu! Come get some hot food! 🌯#HurricaneHarvey	requests_or_urgent_needs
901801055775842304	RT @SI_PeterKing: Please help as much as you can.	requests_or_urgent_needs
902651993105293312	message me if you want to help! #HurricaneHarvey	requests_or_urgent_needs
903398349616799744	HHS medical teams in 3 locations in Texas cared for almost 500 patients in the past 24 hours. #Harvey	rescue_volunteering_or_donation_effort
902667787075760128	If you can please help my hometown of Houston #HurricaneHarvey @NoellBarnidge @TheBC400 @hhihsathletics @savannahderby @UGAAthletics	rescue_volunteering_or_donation_effort
903365037594697729	Please consider joining us and or donating to help our friends in Texas. #Harvey #Houston #NewYork #JerseyStrong	rescue_volunteering_or_donation_effort
903675930056564736	.@seanhannity .@mitchellvii I see the #MSN is pushing for donations for #Harvey2017. How many millionaires in #msm have made a donation?	rescue_volunteering_or_donation_effort
902634463158525952	Donate to help #Refugee Services of Texas #Houston clients and other Texans affected by #HurricaneHarvey	rescue_volunteering_or_donation_effort
902652389316075520	Our prayers are with YOU! Find out how you can help TODAY! #HurricaneHarvey	sympathy_and_support
903377341711298560	Dr. Jonmenjoy Biswas checks w/his family during #HurricaneHarvey flooding during the night. #ThankYouVAEmergencyRoomStaff #HoustonStrong	sympathy_and_support
902850369360986112	. To all the Families affected by Hurricane Harvey, STAY STRONG KEEP PRAYING -- Retweet if you Agree -- .	sympathy_and_support
901818466348433408	Jennifer Bryant looks over the debris from her family business destroyed by #HurricaneHarvey. Give them strength, Lord. ὤFἿC	sympathy_and_support
901746707767193600	This is interstate-45 in #Houston right now. See the flashing roadway signs? Totally submerged. #PrayForHouston #PrayForTexas #Harvey	sympathy_and_support
