tweet_id	tweet_text	class_label
903571542017277952	In an era of dire climate records the US and #SouthAsia floods wont be the last. #climatechange #flooding #weather	other_relevant_information
902607227462221824	I shouldnt be laughing but I am 😂😂😂 #HurricaneHarvey	other_relevant_information
902755817727942656	And 50 feet away from the nearest person who lost everything as a result of the flooding. Will he ever watch himself on video to learn?	other_relevant_information
903356173981806592	Hurricane Harvey: Families wade for their lives amid Texas floods | The Times &amp; The Sunday Times	other_relevant_information
902617248182960128	@MauriceChammah Quick Google search looks like that may be right. Flooding east of them in Danbury, west along the Brazos, but:	other_relevant_information
902689627991105536	Houston flooding always hits poor, non-white neighborhoods hardest. #HurricaneHarvey	other_relevant_information
903627133473382400	@MalcolmNance Hurricane Harvey shows the hypocrisy of the Texas anti-government crowd.	other_relevant_information
901826624928219136	RT @Noeltbrennan: View from my hotel room in Corpus Christi as a category 3 hurricane inches closer #HurricaneHarvey #KHOU11	other_relevant_information
903390073072361473	RT @bustle: Hillary Clinton Reveals How You Can Make A Difference In Tng some of the #Harvey affected areas. We will rebuild &amp;amp; be even	other_relevant_information
903744891104116736	Texas: we’re experiencing a high-call volume to our 800#. We encourage you to use  to apply for assistance. #Harvey	other_relevant_information
901835533537697796	Please help. #Houston #Harvey #HoustonFlood	requests_or_urgent_needs
903646875437461506	We learned from #ColoradoFlood #Harvey survivors with limited resources will need extra help from @NationalVOAD organizations. You can help	requests_or_urgent_needs
902633682602774532	City needs volunteers: anyone who can safely travel 2 the Toyota Center @ 1510 Polk St, Houston, TX 77002. Setting up a new shelter. #harvey	requests_or_urgent_needs
902637254660812800	#Rockport and #AransasCounty need your help! They arent getting the millions Houston is. #HurricaneHarvey #Harvey	requests_or_urgent_needs
903383979176415233	#Beaumont Needs Water .. water systems down.. @RedCross @fema @HoustonFoodBank #KHOU #HurricaneHarvey #HarveyRescue	requests_or_urgent_needs
902696630088081408	Help us ..,,Hurricane Harvey Victim	requests_or_urgent_needs
903051022502961152	wow, all the pets need help. Sending prayers.	requests_or_urgent_needs
903762829345517568	Help us help those in need:  #Texas #TexasFlood #Houston #HoustonStrong #harvey	requests_or_urgent_needs
902849816497184769	Brainstorming ways we can help other classrooms affected by Hurricane Harvey #iteach2nd #PikeRoadWay	requests_or_urgent_needs
902854085728247808	For those at home or abroad looking to help #Harvey disaster survivors in #Texas, @fema has a helpful guide:	requests_or_urgent_needs
902182854364364801	Tropical storm Harvey: 30,000 people will need shelter after flooding in Texas - live  #Harvey #Houston #TexasFlood	requests_or_urgent_needs
902897253454667778	@ASPCA Liberty County,TX had no plans for animals in #Harvey people been keeping animals in cars for days. Any resources pls help.	requests_or_urgent_needs
903749468868157440	Stock feed, hay, livestock bedding, buckets, troughs &amp; more. Its needed. BUT call first before you donate: 979-845-7800. #HurricaneHarvey	requests_or_urgent_needs
902853790310785024	Help for horses in Hurricane Harveys aftermath in Texas  #horses #HurricaneHarvey #AnimalWelfare #GoodtoKnow	requests_or_urgent_needs
902673744879116289	Want to help Hurricane Harvey survivors, but not sure how? Become a digital responder! Start your own fundraiser:	requests_or_urgent_needs
902850402965704704	telling me what I need to be doing to help these victims of #HurricaneHarvey DOES NOTHING!!! focus on what YOU should be doing to help them	rescue_volunteering_or_donation_effort
903749687555088387	I wanted to do more than my #RedCross donation to help those affected by #Harvey. I decided to	rescue_volunteering_or_donation_effort
903428322692124673	Over $4000 raised in 15hrs to help buy medical supplies for #Harvey survivors!!! #DPC docs &amp; patients are amazing! @BrianCurtisNBC5	rescue_volunteering_or_donation_effort
902648322879623182	Omega Charities has established a Hurricane Harvey Relief Fund. Contributions will be accepted online at	rescue_volunteering_or_donation_effort
902853376366575616	@12NewsNow @KHOU Port Arthur does not have the resources to adequately rescue victims. My family has been stranded for hours, help!	rescue_volunteering_or_donation_effort
902638780842049536	@jlaustinorg is helping collect and distribute items needed for #HurricaneHarvey victims. For more information:	rescue_volunteering_or_donation_effort
902656342577614856	When disasters like #Harvey strike, this Longmont rescue organization makes sure pets arent left behind	rescue_volunteering_or_donation_effort
903633692530270210	Getting animals out of harms way. #Floods #HurricaneHarvey	rescue_volunteering_or_donation_effort
902670128872964096	This is amazing. Neighbors reaching out to help others in need. #Harvey2017 #Houston	rescue_volunteering_or_donation_effort
902878902535811072	For a big hat guy hes got a big heart to match. #Houston #Harvey #flooding #fundraiser	rescue_volunteering_or_donation_effort
902918071849013252	ICYMI, Commissioner Morath authorizes Missed School Day waivers for districts affected by Hurricane Harvey.  #txed	rescue_volunteering_or_donation_effort
902649769159483392	Great work from @DataKindDC volunteers now being used by @CCharitiesUSA to direct relief efforts after #HurricaneHarvery #data4good	rescue_volunteering_or_donation_effort
903747580315574272	We are sending our love to Texas. ALL proceeds from this tee will be donated to the Hurricane Harvey Relief Fund - .	rescue_volunteering_or_donation_effort
903748403481284608	Students Collecting Donations for Hurricane Harvey Victims September 1, 2017 - Zach Anders - News Students in	rescue_volunteering_or_donation_effort
903744308771258369	Made a new tee for @SWStheband! 🌹 100% of the proceeds go to hurricane Harvey relief 🌹	rescue_volunteering_or_donation_effort
901818466348433408	Jennifer Bryant looks over the debris from her family business destroyed by #HurricaneHarvey. Give them strength, Lord. ὤFἿC	sympathy_and_support
902652810474414080	Our hearts go out to those in #Texas affected by #HurricaneHarvey. Join us in donating to the relief fund. #HoustonStrong	sympathy_and_support
902750259918589959	Got this from the father of a hula hoop performer who was killed in Pakistan 2 years ago. Prayers from across the earth ❤️#harvey #houston	sympathy_and_support
902657604756934664	Our thoughts and prayers are with all of the families and schools affected by the wrath of Hurricane Harvey.	sympathy_and_support
902851677895745537	Our thoughts and prayers go out to all those impacted by Hurricane Harvey. You can help by donating today:	sympathy_and_support
903397548165083142	Our thoughts and prayers are with everyone whose been affected by #HurricaneHarvey especially our @HAIS_ECHS family. #WeareHAIS	sympathy_and_support
902637101816139776	This is How Texans do Disasters! So Blessed to live in a state where we are proud to help our neighbors #HurricaneHarvey #TexasStrong	sympathy_and_support
901759289488019456	RT @AlwaysActions: ὤF#PrayForTexasὤF #HurricaneHarvey Ὢ8 #Harvey2017 #Texas Category 4 Hurricane	sympathy_and_support
903048614641098754	Our thoughts and prayers are with all those affected by #HurricaneHarvey. We will wear this helmet decal in their honor for Saturdays game.	sympathy_and_support
902850571891351552	So sad for those affected by Hurricane Harvey.. stay safe guys and be careful. #horses #ranch #hurricane #harvey #hurricaneharvey #cowboys	sympathy_and_support
903056031760216065	@jasksonite Thank u very much, we need all prayer right now!! Its so sad down here.so many lives destroyed #HurricaneHarvey	sympathy_and_support
901826946291650560	RT @RadioDJBJ: Prayers for everyone in TX. Flood is worse than its ever been, &amp; they still have at least 3 more days of rain #Harvey	sympathy_and_support
903681480118996992	#Harvey #Harvey2017 #HarveyRelief #HarveyFlood Dont just pray for people, help them! Life is not all about you. faith w/o works is dead	sympathy_and_support
901787918896857089	Ὁ4Attending extra church service to ὤFἿC for Loves homes flooded in #Houston area. Lighting a candle! #alwaysinmyheart .@mashable #hurricane	sympathy_and_support
902637161392025600	Hang in there, Texans. We are with you. You are strong citizens who will get through this natural disaster together. #Harvey #PrayForTexas	sympathy_and_support
