tweet_id	tweet_text	class_label
1039505181262663680	Florence to re-gain intensity as it moves over warm water (need low 80ssea surface temps in its path are ~86 degrees). Well ventilated hurricane but new info shows weaker winds..bc it’s going through an eyewall replacement cycle.. explanation- @WGNMorningNews @WGNNews	caution_and_advice
1039533003846893568	If you need a ride to the Raleigh shelter, make sure you are at the Government Center (west parking lot) by 3:30 to leave by 4. #HurricaneFlorence #NHCgov	caution_and_advice
1041271445521924097	Remnants of Tropical Depression #Florence will pickup speed later today. By Wednesday AM, remnants will be moving offshore. Until then, flooding will be a concern for the Carolinas into the Mid-Atlantic.	caution_and_advice
1039865200734871552	Forecasters said Florence was expected to blow ashore late Thursday or early Friday, then slow down and dump a torrential 1 to 2½ feet of rain. Flooding well inland could wreak environmental havoc by washing over industrial waste sites and hog farms.	caution_and_advice
1039919205955641345	RT @wis10: Dangerous Hurricane Florence threatens homes of 5 million	caution_and_advice
1039468597431521281	MAJOR HURRICANE FLORENCE keep up with latest Track and intensity at  #wx #weather #lows #temps #hurricane #florence #storm #rain #flooding #highs #storm #spring #tuesday #dangerous #storm #ncwx #scwx	caution_and_advice
1039456168261939200	Even though this article was written for Hurricane Matthew, the tips on how to help stray animals during a hurricane still apply. Please do what you can for homeless animals before Florence hits—and NEVER leave your own pets behind. #HurricaneFlorence	caution_and_advice
1041576390066360320	I-95 at South Carolina Border Closed Due to Flooding	caution_and_advice
1039898580948082688	Charleston County moves to OPCON 1 which means a disaster or emergency situation is in effect. Full-fledged emergency response operations are ongoing. Residents should complete hurricane preparations. #HurricaneFlorence	caution_and_advice
1039477306417393664	If Florence slows to a crawl just off the coast, it could bring torrential rains to the Appalachian mountains and as far away as West Virginia, causing flash floods, mudslides and other dangerous conditions.	caution_and_advice
1039449998851821570	For those worried about flooding where they live, heres the floodplain map to help you determine your risk. Please RETWEET so we can make sure as many NC residents as possible have this and can prepare. #HurricaneFlorence	caution_and_advice
1039552912375119872	Breaking If you are evacuating the coastal areas of North and South Carolina. Charlotte Motor Speedway has opened their Rock City Campground beginning at noon Tuesday for evacuees heading west or inland from Hurricane Florence	caution_and_advice
1040549699290365952	ICYMI: Heres a quick explainer of why #stormsurge flooding is so bad in #NewBern #NCwx this morning even though the city is 30 miles from the ocean. Strong ENE winds on the N side of #Florence are aligned perfectly to funnel water down the Neuse River #Florence	caution_and_advice
1041284255219937280	RIGHT NOW: Flash Flood Watch for parts of our region because of #Florence It expires 12 AM Tuesday. Be careful on the roads! #wjhlwx	caution_and_advice
1041284994885464065	RT @RobMarciano: #Tornado Watch to be extended once again #Florence	caution_and_advice
1039443331959451649	I lived through 2 major, deadly hurricanes, watch the news regularly. Even if we don’t see the brunt, it can still take out power for days and flood cars and homes, particularly with an already saturated ground. Water, batteries, back up phone power packs. Never too early to prep	caution_and_advice
1040190193645576192	Nucor says it is suspending operations at its Berkeley, S.C., sheet mill &amp; Hertford, N.C., plate mill ahead of the arrival of Hurricane Florence  @SeekingAlpha	caution_and_advice
1040164612728123392	Morning Everyone! The latest on #Florence this morning. The weakening has lowered winds to a Category 2 storm.but, this will still cause catastrophic damage to the Carolinas. For us on Delmarva, beach erosioncoastal floodingsome rain and wind are the concern. -Mike	caution_and_advice
1040146718975713280	Some slightly better news with #HurricanceFlorencethe winds have reduced to 110mphcategory 2. Wind damage, #stormsurge and flooding will be still big though. Landfall Thursday night US timeon track for N Carolina or border with South C.	caution_and_advice
1039583068523192320	RT @Ryan11Alive: Now Charlotte Motor Speedway has opened up its campground for #Florence evacuees. #11Alive	displaced_people_and_evacuations
1039867267713048576	Sneak preview of the folks who stuck it out in Greenville and made it through #HurricaneFlorence only to deal with the inevitable widespread flooding that will happen afterward:	displaced_people_and_evacuations
1039480011701534721	Follow SC Gov. McMaster’s Hurricane Florence evacuation order, but settle ambiguity on Beaufort County lane reversal	displaced_people_and_evacuations
1039582924293726208	#evacuation for #FlorenceNC Cabin rentals in Blue Ridge, GA #hurricane #evacuationplan #HurricaneFlorence #WeatherUpdate #weather #MandatoryEvacuation #SouthCarolina #NorthCarolina	displaced_people_and_evacuations
1040550248123379712	RT @wcti12: BREAKING: Jacksonville hotel with around 70 people evacuated after storm damage from Hurricane Florence.	displaced_people_and_evacuations
1040156455800909824	Based on the reports of people failing to evacuate the Carolina coast, we may be facing a very high death toll when #HurricaneFlorence arrives. ὢDὢD	displaced_people_and_evacuations
1039921054137892864	Pet Friendly Evacuation Shelters for Hurricane Florence: this site will take you to shelters that allow all pets!!	displaced_people_and_evacuations
1039910657725005825	Every person in #HurricaneFlorence evacuation zones should be evacuated by Wed., Sept. 12. Text SHELTER and your zip code (i.e. SHELTER 12345) to 4FEMA (43362) to locate an open shelter near you.	displaced_people_and_evacuations
1041398164144709635	Swift water teams evacuating residents in Leland, NC @weatherchannel pattern @amhq #hurricaneflorence @ Leland, North Carolina	displaced_people_and_evacuations
1039403730557435904	Much of Southeast coast under evacuation orders ahead of Hurricane Florence	displaced_people_and_evacuations
1040186166920835073	RT news6wkmg: RT MarkLehman6: Dangerous beach conditions remain in Volusia County as thousands from the Carolinas are flooding into our area. We’re hearing from some of those evacuees this morning on #News6.	displaced_people_and_evacuations
1040157350638702592	It is concerning that these local jails are planning not to evacuate for #HurricaneFlorence . People who are incarcerated deserve safety &amp; should not be subjected to the traumatic experience of weathering this hurricane in the most at-risk areas.	displaced_people_and_evacuations
1039553427804758024	@amycrosshile @LCWxDave @EdPiotrowski Its 1.5+million they say that are being evacuated from NC,SC&amp;VA They cant evac to the #HurricaneFlorence effected areas upstate either. So- its a lot of ppl w/ quite a ways to travel	displaced_people_and_evacuations
1039533005289730050	Hurricane Florence draws closer as evacuations, preparations continue | WTOP #DC #WDC #WashingtonDC	displaced_people_and_evacuations
1039594550384197632	Hurricane #Florence is heading to the east coast therefore @SLOinUSA is calling to all Slovenian citizens in the area to follow the evacuation plans or in emergency call us 202 413 4609	displaced_people_and_evacuations
1039910607615447040	#Durham will open two evacuation shelters today ahead of #HurricaneFlorence. One will open at the Bahama Ruritan Club (8202 Stagville Road) at noon, the other at Hillside High School (3727 Fayetteville Road) at six p.m. The Hillside shelter will be pet-friendly.	displaced_people_and_evacuations
1039430605295906816	ἰ0~ #Evacute regions under ⚠️ threat ⚠️ from #HurricaneFlorence ! ~ἰ0 ἰ0#Weather #Evacuations * ~ #FLOODING ~ * #EyeWall #EastCoast #Cat4ἰ0 ἰ0#USA #HurricaneHunteres * * *ἰ0* * * #TuesdayMotivation #Florence ἰ0 &gt;#LivesἷC+#Pets ὃ1+#MedsὈA+#Papers+ὖF️&lt;	displaced_people_and_evacuations
1040708020941074433	Walking back my prior post somewhat about ignoring evacuation orders. This article gives another perspective. However Shelters are free. I cant afford to leave my home: evacuating too costly for some in path of Hurricane Florence	displaced_people_and_evacuations
1040192102985023489	The sun is up in Wrightsville Beach, NC. Mandatory evacuation begins today at 8 AM. At 8 PM, no one is permitted on the beaches #ncwx #Florence #HurricaneFlorence @WNCN	displaced_people_and_evacuations
1039922351239036930	Weve added over 1,000 extra seats and extra flights to and from the affected cities to assist with Hurricane Florence evacuations.	displaced_people_and_evacuations
1039922023693279239	#hurricaneflorence #ifyoustayyoupay if you stay in an area that is under an evacuation warning for a pending natural disaster, you should have to pay any associated cost for your rescue, medical expenses and cost to repair / replace a vehicle you could have driven away.	displaced_people_and_evacuations
1040553040066093056	People were told to evacuate for at least 5 days straight. They chose to stay. Now they need rescuing. So strangers have to risk their lives to rescue them. If a rescuer dies in the attempt, will the self-made victims feel sorry? Will media blame Trump?	displaced_people_and_evacuations
1039511318259064834	A Facebook page has been created to help evacuees find temporary shelter in the CSRA for their pets they can’t take with them. The page is: Evacuated Pets Who Need Shelter From Hurricane Florence. The goal is to have no one leave their pets behind. #FlorenceWatch	displaced_people_and_evacuations
1042053560924553216	Hurricane calories dont count right? #evacuees @ Tobaccoville, North Carolina	displaced_people_and_evacuations
1039583544010584064	.@NC_Governor has ordered a mandatory evacuation for barrier islands. Read the executive order here:  #ncpol #HurricaneFlorence	displaced_people_and_evacuations
1040548180105076736	There are now more than 320,000 customers without power in across North Carolina as #Hurricane #Florence continues to batter the state, per the states Dept. of Emergency Mgmt. #NCwx	infrastructure_and_utility_damage
1039466009034452992	Hurricane Florence may cost insurers 15-20 billion USD in damage	infrastructure_and_utility_damage
1042055898015981568	FIRST FLIGHT: @FlyWilmILG back open after #HurricaneFlorence — we were on first @Delta flight out this morning. Aerial view shows some damage on ground and area still flooded. @MyNews13 @MyNews13Weather @BN9 @SpecNewsCLT @SpecNewsTriad #SpectrumNews @NWSWilmingtonNC	infrastructure_and_utility_damage
1041744862792568832	A small army of drones are being deployed to identify and fix damage caused by #HurricaneFlorence flooding.	infrastructure_and_utility_damage
1042080638226976768	Even 80 miles inland, still seeing damage from Hurricane Florence. #hurricaneflorence #tropicalstormflorence #hurricaneflorence2018 #hurricanedamage #steeple #wtsp #winddamage #nws @	infrastructure_and_utility_damage
1041282046084231171	Across New Bern, residents are starting to assess damage from Florence. The hurricane may have made landfall nearly 100 miles south, but this city of 30,000 was among the hardest hit in North Carolina	infrastructure_and_utility_damage
1041632104524787713	Heres an example of the types of damage were seeing to roads across the eastern portion of NC. This can happen at any moment. So please heed the warnings and stay off the roads. #FlorenceNC	infrastructure_and_utility_damage
1040708590753992704	BREAKING: Hurricane Florence was just downgraded to a tropical storm on @FoxNews. The damage has been extensive already. I have friends who live there who called me today. Praying for all there.	infrastructure_and_utility_damage
1040609922977812480	At 10:32 AM EDT, 4 SSE Merry Hill [Bertie Co, NC] 911 CALL CENTER reports TORNADO. PUBLIC SITED A TORNADO AND TREE DAMAGE WAS REPORTED OFF WINSTON FARM RD OFF OF NC 45	infrastructure_and_utility_damage
1042059962787266561	Photo and video of damage, destruction caused by Hurricane Florence - The Washington Post	infrastructure_and_utility_damage
1039594647365009408	Hurricane Florence could cost the East Coast more than $170 billion and damage nearly 759,000 homes and businesses, according to an analytics firm	infrastructure_and_utility_damage
1041224912244039680	ἰ0#Florence update: ▶NC: 845,952 customer power outages ▶SC: 167,476 customer power outages ▶ Crews begin to perform limited/intermittent damage assessments and restorations. ▶ Read the latest situation report:	infrastructure_and_utility_damage
1039834476690526208	Hurricane Florence is a monster storm of a lifetime. Damage from winds &amp; flooding will be of biblical proportions. Flooding will occur inland, not just on the coast. Power will be out for weeks. Flooded manure pit &amp; industrial sites will contaminate homes.	infrastructure_and_utility_damage
1039909334887657472	Hurricane Florence Could Cause Even Greater Damage Because of Republican Deregulation -  on @Esquire	infrastructure_and_utility_damage
1042192305279696897	This is drone video out on Folly where the Army Corps of Engineers were determining if any damage occurred during Florence. Crews were also getting things in place to continue its renourishment project which has been extended  #chsnews #scnews	infrastructure_and_utility_damage
1041992919429787648	Waterkeeper Alliance has posted images of its first flyover of CAFOS after Hurricane Florence. We still know very little about how much contamination &amp; livestock drowning resulted, but many buildings &amp; waste lagoons were submerged #flickr	infrastructure_and_utility_damage
1042017609355603969	Lane shift in place on US 117 South between Old Mount Olive Hwy &amp; George St in Wayne County due to rising water from Neuse River. All traffic down to 2 lanes #Florence @wraltraffic	infrastructure_and_utility_damage
1040157292883333120	Hurricane #Florence could cause more than $170 billion in damage to the East Coast this weekend and become the costliest hurricane in U.S. history.  via @upi	infrastructure_and_utility_damage
1041635990748753921	Hurricane Florence brought a lot of damage to New Bern, but the community is working together to restore our beautiful town. #carolinastrong #greaterdowntownnewbern	infrastructure_and_utility_damage
1042008725920395264	We’re restoring power on the ground and assessing damage from the sky, with helicopters and drones, in areas we can’t navigate on foot. Crews have restored 1.2 million customers after #Florence but won’t stop until everyone is back on. Track progress:	infrastructure_and_utility_damage
1040708566385156098	Power outages have climbed over 700,000 as Hurricane #Florence continues to unleash strong winds, flooding rain and inundating storm surge across the Carolinas:	infrastructure_and_utility_damage
1039572318090145792	RT @TravHeem: the rain cause the flooding and the wind knock the power lines and trees down lmao that is the hurricane	infrastructure_and_utility_damage
1040812042062651392	Two sobering images from the National September 11 Memorial Museum. First shows the crushed front of Ladder 3’s fire truck from debris of collapsing tower. Second shows the steel impact	infrastructure_and_utility_damage
1041647338035535872	At 7:07 AM EDT, ELM City [Wilson Co, NC] 911 CALL CENTER reports TORNADO. TREES AND POWERLINES DOWN WITH SOME BUILDINGS DAMAGED IN ELM CITY.	infrastructure_and_utility_damage
1040552289495404545	#HurricaneFlorence slams North Carolina with ‘life-threatening’ rainfall and structural damage.	infrastructure_and_utility_damage
1041633388216692736	According to @FeliciaBoltonTV one person has died at the shelter set up Hoggard High School in Wilmington. #HurricaneFlorence	injured_or_dead_people
1039605412146728960	@realDonaldTrump ICYMI - 2,975 people died in Puerto Rico after Hurricane Maria. Almost as many as died on 9/11.	injured_or_dead_people
1039898548257660929	He says this on September 11, when Puerto Rico’s revised Maria death toll is nearly equivalent to the number of people who were murdered on this day 17 years ago.	injured_or_dead_people
1041271792311181313	Hurricane Florence: Eleven now reportedly dead Ex-Hurricane Florence doesnt seem to be giving up, with eleven people reportedly killed by the storms torrential force. The tropical storm, which has been pummelling North and South Carolina over the weekend, has devastated	injured_or_dead_people
1039606234918346752	@MSNBC 60% of storm deaths are due to flooding unless you live in Puerto Rico. #HurricaneFlorence #PuertoRico	injured_or_dead_people
1041280229644349440	@realDonaldTrump It is 11 deaths from Hurricane Florence. It is 11 deaths from Hurricane Florence. Repeat. Report the correct number.	injured_or_dead_people
1040708149618122752	Breaking News: 4 deaths related to Hurricane Florence were reported, including a mother and her infant child, who were killed when a tree fell on their house	injured_or_dead_people
1041234365072596994	Live Updates: Florence Responsible For At Least 12 Deaths In North And South Carolina	injured_or_dead_people
1041216251639554048	Florence Pours On The Rain In The Carolinas; Death Toll Rises To 7	injured_or_dead_people
1041583577346068480	RT @news5wcyb: #UPDATE: Death toll from #Florence rises to 17.	injured_or_dead_people
1039868274392145921	Florence will affect us. A few years ago we had 9 deaths from this from a hurricane. Then these 5. Where is your tweet bragging about this @RepMarkMeadows While you were busy protecting Trump, we needed help here.	injured_or_dead_people
1041634437103005696	The death toll from #Florence is at least 17, as the Carolinas deal with the threat of flooding getting even worse.	injured_or_dead_people
1041995017399795712	TORNADOES AND FLOODS: The remnants of Hurricane Florence continue to wreak havoc – spawning a tornado in Richmond, Virginia, that killed at least one person and with high water rescues and widespread flooding in the storm’s path. @TomLlamasABC reports.	injured_or_dead_people
1042016260228300800	The death toll from #Florence is up to 31 over several states.	injured_or_dead_people
1040761636145917952	Fighting Stigma : Hurricane Florence: Mother and baby killed as storm batters US	injured_or_dead_people
1039865934087901184	@realDonaldTrump You’re the incompetent loser. The mayor of San Juan is dead on accurate about how to failed them, YOUR PEOPLE!!! You aren’t prepared for hurricane Florence you are saying things you don’t even mean. You’re a joke of a leader.	injured_or_dead_people
1039880318373781504	RT @alex_s_thomas: *Thousands* of people died.	injured_or_dead_people
1041604501008871424	At least 14 people have now died from Florence, but this prohibitionist thinks it’s appropriate to compare marijuana legalization as a disaster on par with deadly hurricanes. You’re disgusting, Kevin.	injured_or_dead_people
1041291093248106496	Florence leaves path of destruction; at least 13 killed amid growing flood emergency @ Vaughan Mills Road	injured_or_dead_people
1041636876703154176	Historic flooding across the Carolinas, death toll rises to 17 and Florence is still moving across the Eastern US dumping rain. #HurricaneFlorence #BreakingNews #BREAKING #Weather #hurricane	injured_or_dead_people
1041989898545373184	Updates on Florence from over the weekend:| -18 dead, 750k without power -Its still goddamn raining -Rivers and creeks are still rising -Theres been at least one coal ash spill -pig manure lagoons appear OK for now more:	injured_or_dead_people
1041220787104034816	USA HURRICANE - 4 New victims raise number of US deaths from T.S. Florence to 9	injured_or_dead_people
1039605526752100353	Nearly 3,000 people died - roughly the same number we lost on 9/11	injured_or_dead_people
1040708277955424256	RT @FoxBusiness: First deaths reported from Hurricane Florence after Wilmington home collapses.	injured_or_dead_people
1041572904092295169	#HurricaneFlorence: Death Toll Spikes To 17, Flooding Will Only Get Worse In The Days Ahead	injured_or_dead_people
1039972139129024516	Triple play breakfast/lunch/dinner play since I havent eaten anything since *yesterday* ὣ3ὣ3 Egg, bacon, blue cheese, burger, salad. Saves me from airline food, more time to sleep. #lchf	not_humanitarian
1041382778242256896	LIV ULLMAN IS IN THE BUILDING!!! #IngmarBergman @ Coolidge Corner Theatre	not_humanitarian
1040923954326765569	Almost time @ToughMudder #toughmudder #toughermudder #toughmudder2018 @ Christie Lake Conservation Area	not_humanitarian
1040798260452106240	Anything in your city delivered fast by Ozi On Demand Delivery Service. Supermarkets , local restaurants, fast food, Gas, hardware stores, pharmacies and anything else you can think	not_humanitarian
1040153857047883777	Yeah, its Trump thats complicit. Not HAARP of course. I guess he was also complicit in the destruction of Haiti, and the millions of dollars funneled into the Clinton Foundation too, right? Bunch of sick fucks over there at Bezos newspaper.	not_humanitarian
1039920374031568898	Not only took from FEMA disaster relief but he did it at the hight of hurricane season. Its important for this fool to imprison more minorities and children no matter the suffering caused to the imprisoned or victims of a disaster like Puerto Rico	not_humanitarian
1039498818742624257	woke up at 6am to look for water. went to 4 stores and finally found some at Target in Garner. having a slight panic attack about #HurricaneFlorence but trying to stay calm ὤ3	not_humanitarian
1042057372544512000	If you abandon your pets like this when you’re evacuating Bc ‘you don’t have room’ well then fuck You. Don’t get a fucking animal; a living creature if you can’t take it with you. If you can’t make room. People would be way more attentive to this if it were human children.	not_humanitarian
1039899985033261056	For a homework assignment, Im studying what happened with the Arkema explosions during Harvey last year. We design buildings with risk of disaster involved. However, we base our models on what we know.	not_humanitarian
1041349809947521025	Tour of Homes! (@ Columbus Victorian Village in Columbus, OH)	not_humanitarian
1041681236375220224	Ulta Beauty has your back, and we want to help you achieve your goals! Ulta Beauty is excited to announce that we have an opening in #Vestal, NY! Click here to learn more: General Manager #hiring #ultabeauty #careers  #Retail #Job #Jobs #CareerArc	not_humanitarian
1041332580103016448	Bobby Ray’s Pennsauken Tavern hosts Thursday Night Texas Holdem poker game!! 7pm - FREE to play (no buy-in). Hosted by Kontenders Poker! Great prizes! Earn extras, VIP 5K, buy food	not_humanitarian
1042052472553054214	RT @tala_clark: you don’t deserve to live if you do this to your pets. PETS ARE APART OF THE FAMILY. NOT TOYS	not_humanitarian
1040796704826699777	Food! (at @McDonalds in Barberton, OH w/ @abbylovestosing @kituwagikid @coldshadow86)	not_humanitarian
1041016779189968897	Looks like a perfect Saturday to me! How are you spending yours? Ὀ4Ὁ5὆0Ὤ1 #agelessimage #pretty #glam #selfcare #loveyourself #skincare #saturdaynight #roseallday #wine #food #bath #chill	not_humanitarian
1040557023992197120	Turned 40. ὢC὇4ἿC Food Is Life ὐ4♻️ ὆8ἿD‍ἷ3 @Chef_CB1978 ὆8ἿD‍ἷ3 ἷ1 @burnglc ἷ1 #birthday #oldman #hurricaneflorence #work @ Green Lean And Clean	not_humanitarian
1040574390759501824	This is where many of my meals come from. Are they Instagram worthy? Maybe not. But I am all about making nutritious and tasty food in a way that fits into our busy lifestyles. This	not_humanitarian
1039864061582876673	Everyone in the path of Hurricane Florence should be comforted knowing that @IvankaTrump is fully prepared to look gravely concerned and @FLOTUS has picked out the perfect pair of Manolo Blahniks for visiting devastated areas.	not_humanitarian
1042104168352296962	ὤCἿE It’s beer’o’clock in BocaἷA . . . #foodie #picoftheday #foodporn #nomnomnom #hungry #amazing #bestthingever #food #forkyeah #tasty #beerporn #beerolympics #beerlover #beerἷB#beerbeerbeer	not_humanitarian
1040222586532229122	some pics from last week’s launch party for : Quickly Connecting Patients with Clinical Trials - Specializing in Brain Cancer &amp; MS. . . . . #multiplesclerosis #braincancer	not_humanitarian
1039908179008733184	Every night I go to bed thinking Well thats it, the media cant possibly get any more ridiculous And then the next day greets me Trump - Water is wet. MSM - OMFG! Did you just hear what Trump said?! Were all going to die!	not_humanitarian
1040553453175504897	RT @theturner: When you are looking for an instantly relatable measure of height and forget that there are eight-storey buildings	not_humanitarian
1041526556982759425	I hear there is a face behind these falls that sometimes you can see when the water is low and the rocks behind the falls show #waterfall #letchworthstatepark #beautiful @ Letchworth	not_humanitarian
1041158173711839232	This meatloaf was so good it warranted a double post. When Vincentown Diner was featured on Food Network, this Mile High Meatloaf was one of the dishes they made. This meatloaf was	not_humanitarian
1041586247448322048	Tryna Do DAMAGE You Do y Do It Enough -Slimm @ Brooklyn, New York	not_humanitarian
1039834155452915712	The land in Texas was fairly dry last year. The east coast has been getting rained on for weeks and the ground is already saturated, the rivers are to their banks, Florence will cause catastrophic flooding.	other_relevant_information
